appearance,delivery,fabric_quality,others,packaging,price,service,size_fit,processed_text
3,0,3,0,0,0,0,0,bà_xã mặc rất đẹp dễ_chịu
0,0,0,0,3,0,0,0,hàng chất_lượng shop nhiệt_tình gói hàng kín_đáo sẽ tiếp_tục ủng_hộ shop
3,0,3,0,0,0,0,0,vải mát mịn đẹp form ôm mọi người up lên 1 size là vừa
0,0,0,2,0,0,0,0,gửi thiếu sản_phẩm yêu_cầu giao lại
0,3,0,0,0,0,3,0,giao hàng nhanh đóng_gói cẩn_thận shop tư_vấn nhiệt_tình sẽ ủng_hộ lần sau
0,3,3,0,0,0,0,0,giao hàng nhanh chất_liệu đúng moi tả
0,0,0,2,0,0,0,0,mình hài_lòng với sản_phẩm
3,0,0,0,0,0,0,0,quần rất đẹp tuyệt_vời lắm tặng shop 5 sao công 5 sao nữa mọi người nên mua quần mặc vào rất đẹp tôn dáng ship giao hàng rất vui_vẻ
1,0,0,0,0,0,0,0,nhìn hình thì đẹp mà nhận hàng thì thôi rồi đã vậy chốt cho toàn màu đỏ và xanh tím nữa chắc do ế quá nên bán qua online nhét cho người mua toàn là của quý
0,0,3,0,0,0,0,0,ok thoải_mái
0,0,3,0,0,0,0,0,vải mềm mịn thoáng mát đường may ổn
3,0,0,0,0,0,3,0,sản_phẩm bận lên rất đẹp vừa với người shop tư_vấn rất nhiệt_tình
0,3,0,0,0,0,0,0,gia hành nhanh_chóng đồ bơi mặc tạm ổn điểm trừ là phần mút lót không được may dính liền vào áo nên giặt rất khó phải lấy ra giặt riêng
0,0,3,0,0,0,0,3,áo mặc êm áo thiết_kế vừa khuôn nâng ngực phần áo dày vừa_phải chứ không phải dạng áo độn nên mặc rất thoải_mái đây là cái thứ 3 mình mua ở shop này rồi rất ưng_ý luôn
0,0,0,2,0,0,0,0,mình đã mua 2 áo dựa vào cân nặng nhưng đúng là cân nặng chỉ mang tính tham_khảo nay mình có nhu_cầu đổi 2 áo xl thành 2 áo xxl thì làm cách nào ạ vui_lòng hướng_dẫn giúp mình cảm_ơn tiki rất nhiều
0,0,3,0,0,0,0,0,sản_phẩm_chất_lượng hài_lòng
3,3,0,0,0,0,3,0,được của nó shop giao hàng nhanh tư_vấn size kỹ tư_vấn dễ_thương vui_tính đồ đẹp mỗi tội mình không có nhiều tiền để mua kk lần tới sẽ ủng_hộ shop tiếp chúc shop thành_công
0,0,3,0,0,0,0,0,áo mặc rất thoải_mái cảm_ơn shop
3,0,0,0,0,0,3,3,sản_phẩm rất đẹp mặc vừa ưng lắm nếu có dịp sẽ quay lại ủng_hộ shop tiếp mặc_dù có chút sự_cố nhưng shop đã giải_quyết nhanh_chóng yêu shop
3,0,3,0,0,3,0,0,quần đẹp giá rẻ vải tốt
0,0,0,0,0,3,0,0,giá tốt đáng tiền lần sau sẽ tiếp_tục ủng_hộ shop
3,0,0,0,0,0,0,0,mẫu này màu trắng shop mới ra thì phải lúc trước không thấy nói_chung áo rất đẹp 9 điểm
0,3,0,0,3,3,0,0,giao hàng nhanh gói hàng cẩn_thận giá tốt hài_lòng về sản_phẩm nha
3,0,3,0,0,3,0,0,giá phải chăng chất_lượng vải tốt màu_sắc hoạt tiết xinh_xắn đáng yêu
0,0,0,2,0,0,0,0,sản_phẩm tốt hơn mình nghĩ ren đẹp lại nâng_đỡ tốt dù không có gọng mua 2 set đen và nude rất ưng_ý
3,0,3,0,0,0,0,0,sản_phẩm đẹp mặc mát
0,3,3,0,0,0,0,0,sản_phẩm_chất_lượng vải đẹp và co_giãn shop giao hàng nhanh
0,0,3,0,0,0,0,0,áo dày ngoài mong_đợi
0,0,0,2,0,0,0,0,đặt 2 màu đỏ_đen mà gửi về trắng và hồng
0,1,3,0,0,0,0,0,rất tốt trừ mỗi hai tuần hàng mới về
0,0,3,0,0,0,0,0,hàng đẹp cầm nặng_tay cao_su bên ngoài_mặt trong cotton định_hình bụng tốt thoải_mái khi đeo hàng xịn giá hời đáng mua không bị cuộn mình 53kg 158cm đeo size s vẫn thấy hơi dài
0,0,1,0,0,0,0,0,chất_liệu giống như polyeste thấy có vẻ không thoáng lắm
0,0,3,0,0,0,0,0,rất ok nha mọi người nên mua mặc thoải_mái ngon_lành lắm ạ cho shop 5 sao sẽ mua lại
3,0,3,0,0,0,0,0,đẹp form rất ưng_ý vải ok đường may kĩ ok
0,0,3,0,0,0,0,1,chất_liệu cotton mát trắng_tinh áo hơi dài so với mình
3,0,3,0,0,0,0,0,vải mỏng ôm sát mặc lên rất đẹp chất_lượng phải sử_dụng lâu_dài mới biết được
3,0,0,0,0,0,0,1,áo đẹp nhé nhưng mà hơi nhỏ chắc mua size lớn hơn là ok
0,0,0,2,0,0,0,0,quần tạm được với giá_như vây
0,0,0,0,0,0,0,1,bầu_bạn mà chật như bầu anh chật khó mặc mặc lâu thì không_thể chịu nổi
3,3,3,0,0,0,0,0,màu dễ_thương chất vải mỏng mát mình chụp cận vải và bên trong quần cho mọi người xem kỹ mua shop nhiều lần rồi ưng lắm giao rất nhanh
3,0,3,0,0,0,0,0,bộ đồ xinh thoải_mái khi vận_động mình chưa đi bơi chỉ tập thôi ạ chất_lượng ổn so với giá tiền
0,0,0,2,0,0,0,0,chất_lượng ok
0,0,3,0,0,0,0,0,mặc dễ_chịu thoải_mái chất_liệu quần_mát
0,0,0,2,0,0,0,0,lần đầu mua đồ lót online mà mình ưng_á
0,0,3,0,0,0,0,0,mặc thoải_mái ok
0,0,3,0,0,0,0,0,chất_lượng sản_phẩm tốt
0,3,0,0,3,0,0,0,giao đúng đủ số_lượng giao hành nhanh đóng_gói cẩn_thận hài_lòng về chất_lượng sản_phẩm
3,0,0,0,0,0,0,0,mỏng mát không lộ viền đường vải là rất đẹp
1,0,0,0,0,0,0,0,màu_sắc như hình đường nay không tốt chưa mặc đã bung dù đã chọn size rộng
0,0,3,0,0,0,0,0,áo chất_liệu tốt
3,0,0,0,0,3,0,0,vải đẹp rẻ rất hài_lòng
3,0,0,0,0,0,0,0,chưa xài nhưng nhìn vải ok
1,0,0,0,0,0,0,0,mới mặc vào rách toạc đường chỉ
0,0,1,0,0,0,0,0,sản_phẩm giống hình chất vải không mềm mịn
0,0,0,2,0,0,0,0,shop giao sai mình mua bộ này mà shop gửi gì đâu đã hoàn hàng và chờ tiki giải_quyết
0,0,0,0,0,0,0,3,form rất vừa_vặn thoải_mái rất ưng_ý sẽ ủng_hộ dài_dài và giới_thiệu bạn mua mong shop giữ vững chất_lượng và giá_cả như_vậy
1,0,0,0,0,0,0,0,mong_muốn mua 1 bộ quần_áo sáng thì nhận được 1 bộ quần_áo trông xấu xấu bẩn bẩn người bán hàng nên đăng ảnh trung_thực hơn đỡ mất thời_gian hai bên
0,3,0,0,0,0,0,0,lần đầu mua rất hài_lòng hàng giao nhanh
3,0,3,0,0,0,0,0,sản_phẩm đẹp mặc vào rất là ấm
3,0,3,0,0,0,0,3,mặc thấy vừa_vặn đúng khoảng cân nặng mà shop tư_vấn quần có thiết_kế ổn màu_sắc hài hòa_chất_liệu cotton thấm hút rất tốt khiến người mặc không bị khó_chịu
0,0,3,0,0,3,0,3,ảnh không liên_quan cho lắm hi quần giá hạt_dẻ size chuẩn mặc thoải_mái đáng mua nha
3,0,3,0,0,0,0,0,màu_sắc_đẹp vải khá ok
0,0,3,0,0,0,0,0,quần mặc mát mịn
3,0,3,0,0,0,0,0,quần đẹp nha chị_em vải dày co_giãn tốt hack chân dài triệu like
0,0,0,2,0,0,0,0,sản_phẩm tốt chuẩn như mong_đợi có bảo_hành_hạ size rất ok
0,3,3,0,0,0,0,0,giao hàng nhanh quần mặc mát
0,0,0,2,0,1,0,0,sản_phẩm bình_thường giá cao
0,0,3,0,0,0,0,0,chất_liệu minh mát mặc khá thoải_mái nè nói_chung ổn
0,0,3,0,0,0,0,0,vải đẹp form đẹp
3,0,3,0,0,0,0,3,vải đẹp may chắc_chắn mặc rất thoải_mái
3,0,0,0,0,0,0,0,áo đẹp quá
0,0,3,0,0,0,0,0,thoải_mái và dễ_chịu
0,0,0,0,0,0,0,3,mình mua ở đây nhiều lắm lần nào cũng ưng gì đâu á quần ôm mông mặc cùng jean và legging không bị hằn viền
0,0,2,0,0,0,0,1,sản_phẩm để size không đúng chất_liệu vải bình_thường
0,0,0,2,0,0,0,0,hàng giống hình nhưng dáng mình không đẹp mặc vô không hợp ai ngực bự chắc sẽ đẹp hơn
3,0,1,0,0,0,0,0,đẹp nhưng hơi mỏng
0,3,0,0,0,3,0,0,giao nhanh sản_phẩm tốt tiết_kiệm nhiều chị phí hàng lại hợp_lý ví tiền cần mua
3,0,3,0,0,0,0,0,sản_phẩm đẹp vải mịn dày_dặn còn được tặng thêm quà hình_ảnh chỉ mang tính minh_hoạ
3,0,0,0,0,0,0,0,quần rất đẹp mình rất ưng_á
0,0,0,2,0,0,0,0,shop phục tốt
0,0,0,2,0,0,0,0,quần thì cũng được nhưng ghét cái giao hàng 5 cái thì 3 cái màu đen
3,3,0,0,3,0,0,0,xinh lắm giao hàng nhanh đóng_gói đẹp nhất trên mạng
3,3,0,0,3,0,0,0,sản_phẩm đẹp đúng mô_tả giao hàng nhanh đóng_gói cẩn_thận cảm_ơn shop kkkkkkkkkkkk
3,0,3,0,0,0,0,0,vải mịn kiểu đẹp giao nhanh hàng chất_lượng
3,0,0,0,0,0,0,3,quần đẹp chuẩn size đã mua cái thứ 4 mà vẫn rất vừa_ý
0,0,0,0,3,0,0,0,rất thích các áo in của goking ý_nghĩa chất_lượng sản_phẩm thì khỏi chê đóng_gói rất đẹp
3,0,3,0,0,0,0,0,đẹp vải mát
1,0,1,0,0,0,0,0,quá nhiều chỉ thừa vải mỏng
0,0,0,0,3,2,2,0,shop có che tên sản_phẩm dày vừa phải có bọc bên ngoài hẳn_hoi sản_phẩm phù_hợp mức giá
3,0,3,0,0,0,0,0,mình đã mua rất nhiều và không nói cũng biết tại_sao sản_phẩm đẹp chất_liệu tốt và giá_thành rất là ok chúc shop hồng_phát
0,0,3,0,0,0,0,3,mua dịp khuyến_mãi được giá tốt chất_liệu sản_phẩm mịn đẹp mặc thoải_mái dễ_chịu sẽ giới_thiệu mọi người mua sử_dụng
0,0,3,0,0,0,0,0,mềm nhẹ
0,3,3,0,0,0,0,0,vải giày dặn xinh_xắn tiền nào của nấy shipper dễ_thương giao hàng rất nhanh
0,0,3,0,0,0,0,0,hàng y_như quảng_cáo đã dùng rất chi là mềm mịn đúng chất_lượng ha shop
3,0,3,0,0,0,0,0,quần mặc thoải_mái chất vải mát đường chỉ đẹp chắc_chắn
0,0,0,2,0,0,0,0,áo không đúng như đơn hàng đặt 2 cái màu đen nhưng khi nhận thì có 1 cái không giống mẫu áo đã đặt
0,0,0,0,0,0,0,3,size chuẩn giúp ôm gọn bụng tốt
0,3,0,0,0,3,3,0,hàng ok lắm nhé giá cũng ok giao hàng nhanh shop rất nhiệt_tình
3,0,0,0,0,0,0,0,hàng đẹp giống trong hình
3,0,3,0,0,0,0,0,chất len đẹp dày_dặn đúng mẫu tốt so với giá tiền mẫu đẹp shipper nhiệt_tình vui_vẻ thanks shop
3,0,0,0,0,0,0,0,hàng đẹp nên mua nhé cả nhà hổ trợ nhiệt_tình
3,3,0,0,0,0,0,0,sản_phẩm đẹp giao hàng nhanh
0,0,0,2,0,0,0,0,sản_phẩm ổn ảnh này đang sử_dụng sản_phẩm
3,0,3,0,0,0,0,0,đẹp mát mặc rất ưng_ý
3,0,3,0,0,0,0,0,chất vải mịn form đẹp nữa
0,0,3,0,0,0,0,3,form vừa người đường ép keo chắc chất vải mát vải không dày cũng không quá mỏng thoải_mái rất đáng tiền mua
0,0,0,2,0,0,0,0,sản_phẩm giống như hình
0,3,3,0,0,0,0,0,giao hàng siêu nhanh dù ct16 sản_phẩm y hình rất mát mịn
0,0,0,2,0,0,0,0,nên mua cho 5 sao
3,0,3,0,0,0,0,0,quần đẹp mềm mịn rất mát
0,0,0,2,0,0,0,0,nguồn_gốc xuất xuất không rõ_ràng tem dán trên bao_bì bên ngoài ghi việt nam gỡ ra thì tem bên trong lại ghi xuất_xứ trung_quốc
0,0,0,0,0,0,1,0,đặt size 29 giao size 26 lúc nhận hàng đang bận nên không kiểm hàng giờ đổi sao đây
3,0,0,0,0,0,0,1,màu đẹp nhung quần rộng quá phải bóp lại mới mặc được
1,0,0,0,0,0,0,0,áo in hình không được đẹp như hình_như mọi mặt thì ok
3,0,0,0,0,0,0,2,áo đẹp đúng size
3,0,0,0,0,0,0,0,quần đẹp đáng mua nhé mọi người
0,0,3,0,0,0,0,0,mua sale nhưng nhận hàng lại quá tốt và rất dày_dặn rất đáng mua
0,0,3,0,0,0,0,0,mềm êm
3,1,0,0,0,0,0,0,hàng giao đúng mẫu rất đẹp sẽ ủng_hộ shop tiếp nhưng giao hàng nói_chuyện khó nghe
0,3,0,0,0,0,0,0,màu_sắc nhìn hơi nam_tính mình thích màu trong hình minh_họa hơn shop giao hàng nhanh nên mình vẫn đánh_giá 5 sao
3,0,0,0,0,0,0,1,áo đẹp nhưng không vừa size 36b mình muốn đổi size 36a được không shop nếu đổi được cảm_ơn rất nhiều
0,0,3,0,0,0,0,0,chất vải cũng được nói_chung mặc ngủ ok
0,0,1,0,0,0,0,0,chất vải dày quá mặc khá nóng
2,0,3,0,0,0,0,0,vải tốt_đẹp nhưng mà bị dính sơn thừa
3,0,0,0,0,0,0,0,chất đẹp đường may tỉ_mỉ mua lần 2 rồi mà vẫn thấy hài_lòng
0,0,3,0,0,2,0,0,rất uy_tín chất vải dày ok hơn so với giá tiền
3,0,0,0,0,0,0,0,sản_phẩm tốt may đẹp không rất vừa_ý xin cảm_ơn nhé
0,0,0,2,0,0,0,0,không có kiếm tra hàng nên cho 1 sao
0,3,3,0,3,0,0,3,đóng_gói đẹp và cẩn_thận giao hàng nhanh chất_liệu tốt cân nặng đúng như mô_tả thanks tiki
0,3,0,0,0,0,0,0,hàng mới giao hàng nhanh ship thân_thiện mình mua nhiều lần của shop rồi hàng chất_lượng
0,0,3,0,0,0,0,0,chất_liệu vải rất tốt tuy mỏng nhưng rất bền phù_hợp với mọi người ở độ tuổi khác nhau
0,0,0,0,0,0,0,1,sản_phẩm rất nhỏ so với số kg ghi trong chi_tiết sản_phẩm tôi 57kg mà mặc không vừa thất_vọng
0,1,0,0,0,0,0,0,shipper ở rạch giá rất nhiều lần làm_khó người mua hàng ck trả tiền trước
0,0,2,0,0,0,0,0,vải mỏng mát nhưng có vẻ chất hơi nhăn nhưng mặc ở nhà thì tạm chấp_nhận được phù_hợp với giá_cả
0,3,3,0,0,0,0,0,sản_phẩm nhạy_cảm nên m không chụp áo dùng khá mềm tốt giao hàng nhanh
3,0,0,0,0,3,0,0,hàng đẹp như hình đặt màu nude giá_cả hợp_lý sẽ ủng_hộ tiếp
3,0,0,0,0,0,0,0,hàng đẹp chất_lượng thì chưa biết
0,0,0,2,0,0,0,0,mặc cũng được
0,0,3,0,0,0,0,0,vải thun dày_dặn ít bám nước
0,0,0,2,0,0,0,0,bạn giao đồ cũng bình thương
3,0,3,0,0,0,0,0,đẹp và đa_dạng mặc vào thoải_mái
3,0,0,0,0,0,0,0,áo trên cùng là của mẫu này bản to và ôm đẹp và gọn giá khi mua khuyến_mãi là 239k
3,0,3,0,0,0,0,0,kích_thước mẫu_mã như miêu_tả ba mảnh đều đẹp vải chất may đẹp hài_lòng tiki
0,0,0,0,0,0,3,0,rất ưng cực_kì ưng luôn ạ shop cũng rất nhiệt_tình
0,0,3,0,0,0,0,1,mình đặt màu xám đen sản_phẩm đúng màu như hình vải kháng nước_mềm tuy_nhiên form ngắn quá lỗ xỏ dây cố_định bằng long dền thì 1 con_rơi ra chỉ dư chưa được cắt gọn_gàng nhìn_chung cần cải_thiện qui
0,3,2,0,0,0,0,0,chuyển hàng nhanh chất vải tạm được
3,0,0,0,0,0,0,0,đường may đẹp dáng được màu mình không hợp màu hồng mà mình 50 tuổi rồi nhưng shop đã nói rõ màu ngẫu_nhiên không được chọn nếu shop cho chọn màu thì tốt hơn
0,0,0,0,0,0,0,1,kích_thước không đều
3,3,0,0,0,0,0,0,quần rất đẹp hàng y mẫu đúng sai giao hàng nhiệt_tình_cảm_ơn nhà bán hàng cảm_ơn tiki các bạn nữ nên mua nha
3,0,0,0,0,0,0,3,áo siêu đẹp và nâng ngực lắm mình rất ưng nên cứ mua quá nhiều lần loại áo lần đầu_tiên trong đời mình ưng
3,0,0,0,0,0,0,0,áo đẹp hơn hình nha mọi người lên mua
0,0,0,2,0,0,0,0,mình nhận hàng dùng khá ổn so với giá do sản_phẩm hơi nhạy_cảm nên xin phép không dùng hình_ảnh
3,0,0,0,0,0,0,0,quần thích lắm cạp cao_ngất co_dãn độ dài chân cũng ok luôn sẽ mua thêm
3,0,0,0,0,0,0,0,vải đẹp nhưng đặt size l mà gửi size xl_vậy
3,0,0,0,0,0,0,3,mặc đẹp và vừa lắm kể_cả cho các chị_em 75kg luôn chất_liệu vải miễn chê đáng đồng_tiền sẽ ủng_hộ shop lâu_dài chỉ mỗi_tội shop để mã_số để lựa kiểu thì hơi căng vì không biết mã nào đi với kiểu
0,3,0,2,3,2,0,0,sản_phẩm tốt phù_hợp giá tiền đóng_gói chắc_chắn và giao hàng nhanh
0,3,0,0,0,0,0,0,sản_phẩm_chất_lượng giao hàng nhanh
3,0,0,0,0,0,3,0,mọi người mua ủng_hộ shop này nha shop bán đồ đẹp lắm chủ shop tư_vấn rất dễ_thương nhiệt_tình nè
0,0,0,0,0,0,0,1,vải chắc_chắn hơi nóng xíu bạn nào dưới 52kg thì size s nhé mình 515kg mua size m thì hơi rộng
0,0,0,2,0,0,0,0,khá ổn
0,0,0,2,0,0,0,0,mình rất ưng chiếc áo này cả về kiểu_dáng màu_sắc và chất_liệu
1,0,0,0,0,0,0,0,vải xấu không y_như hình màu không ra màu nói_chung không nên mua mua một lần phải bỏ chạy thôi
0,0,0,2,0,0,0,0,sản_phẩm giống hình giặt lần đầu_ra màu hơi nhiều
3,0,0,0,0,0,0,0,thấm hút mồ_hôi tốt hàng rất đẹp giao hàng che tên sản_phẩm rất hài_lòng
0,0,1,0,0,0,0,0,chất_liệu tệ mặc vào gây cảm_giác ngứa quá thất_vọng
0,0,0,0,0,0,0,1,xin chào tiki khi xem website mình rất thích cái đầm này và đặt mua nó để đi đám_cưới một người_thân vào thứ bảy này 20062020 hôm_nay mình được giao hàng và mặc thử thì không vừa cổ_tay và thân
3,0,2,0,0,0,0,0,quần như hình xinh_xắn nhưng hơi mỏng
0,0,0,2,0,0,0,0,mặt_hàng không như mong_đợi
0,0,0,2,0,0,0,0,nhận hàng rồi ạ mà tay_áo trắng chứ không phải nâu
0,0,3,0,0,0,0,0,rất hài_lòng về quần nha mặc mát mịn vải không xơ cho shop 5 sao mình mặc 1 thời_gian rồi mới đánh_giá sẽ tiếp_tục ủng_hộ shop lần sau
0,0,0,2,0,0,0,0,mình chọn màu vàng nhạt nhưng khi đến lại vàng đậm quá nổi màu
0,0,0,2,0,0,0,0,hàng ok nha mọi người
0,0,0,2,0,0,0,0,áo ôm tốt không tuột có điều đường may của áo nhiều khi cọ vào da hơi cộm chút
0,3,3,0,0,0,0,0,giao hàng nhanh vải đẹp chất_lượng không ngờ luôn ạ
3,3,3,0,0,0,3,0,thun lạnh mát mềm mịn giao hàng khá nhanh_chóng và dễ_thương shop tư_vấn nhiệt_tình
1,0,0,0,0,0,0,0,sản_phẩm không đúng miêu_tả rất xấu
0,0,3,0,0,0,0,0,vải mềm dễ mặc thoải_mái hình có dây rút không túi sau nhưng hàng thực_tế không có dây rút mà_lại có túi sau
0,3,0,0,0,0,0,0,giao nhanh trong ngày luôn á chất_lượng và mẫu_mã ổn nha
0,3,0,0,0,0,0,0,đã nhận được hàng rồi giao hàng rất là nhanh sản_phẩm đúng như mô_tả
0,0,0,0,0,0,0,1,rộng quá
3,0,0,0,0,0,0,0,vải đẹp màu nổi
0,0,3,0,0,0,0,0,sản_phẩm_chất_lượng chất_liệu mát thoải_mái
0,0,3,0,0,0,0,0,mềm_mại
3,0,0,0,0,0,0,3,đẹp bà_xã bận vừa khít 5 sao
3,0,0,0,0,0,0,0,minh mặc ai cũng khen đẹp qua minh rất la thích cảm no ban nhé
0,0,3,0,0,2,0,0,mặc êm thoải_mái ok với tầm giá
0,0,3,0,0,0,0,0,mặc êm thoải_mái
3,0,0,0,0,1,0,0,đẹp dễ mặc nhưng giá cao quá nếu giảm_giá sẽ mua thêm
0,0,0,0,0,0,0,1,hơi chật 1 chút xl thì tốt hơn nhưng không thấy có size xl để mua như trong phần giới_thiệu
2,0,0,0,0,0,0,0,form mặc đẹp nhưng đường may tệ vừa mặc vào ngồi đã rách đáy
3,0,3,0,0,0,3,0,chất đẹp lắm ạ chủ shop nhiệt_tình
3,0,0,0,3,0,0,0,đẹp dùng ok có hộp đựng rất sạch_sẽ tiện dùng lại lịch_sự
3,0,0,0,3,0,0,0,sản_phẩm đẹp đóng_gói đàng_hoàng
0,0,0,0,0,1,0,0,mua lầm sản_phẩm kém chất_lượng nhưng giá cao hơn hàng chất_lượng cao
0,0,0,0,3,0,0,0,chất_lượng sản_phẩm tuyệt_vời đóng_gói sản_phẩm rất đẹp và chắc_chắn
0,0,0,2,0,0,0,0,shop quảng_cáo áo_khoác chất nhung gân nhưng khi mình nhận được hàng thì lại không phải áo nhung gân
3,0,3,0,0,0,0,0,áo may kĩ từ trong ra ngoài vải mịn 60 kí mặc đẹp
0,0,0,2,0,0,0,0,hàng ok chất_lượng
0,0,0,2,0,0,0,0,lưng thấp quá
0,0,0,2,0,0,0,0,giao không đúng màu đã chọn giới_thiệu không đúng hàng thật có đường may
0,3,1,0,0,0,1,0,giao hàng nhanh nhưng không giống mẫu của em chọn vải khá mỏng
0,0,3,0,0,0,1,0,chất thì mát rồi nhưng shop buồn_cười thật m chọn xl thì giao l chọn 1 màu nude thì cho trộn màu bó_tay
3,3,0,0,0,3,0,3,hàng đẹp giá tốt giao đúng màu đúng size giao hàng nhanh
0,3,0,0,0,0,0,0,giáo hàng nhanh sản_phẩm tốt
0,3,0,0,0,0,0,0,hàng ok giao hàng sớm thanks tiki
0,0,0,2,0,0,0,0,đồ như hình
0,0,0,0,0,1,0,0,hơi mắc số với mua ở ngoài
3,0,2,0,0,0,0,3,form lên vừa đẹp mác trung quốc chất_lượng thun mỏng tương_xứng giá tiền thôi chứ không phải thun tốt
3,0,0,0,0,0,0,0,vải đẹp giống hình sản_phẩm dùng ok đã mua lại lần 3
0,3,0,0,0,0,3,0,shop giao hàng nhanh đúng mẫu đủ màu theo yêu_cầu shipper nhiệt_tình cho shop 5 sao
3,0,3,0,0,3,0,0,rất đáng tiền chất đẹp nha mọi người
0,0,3,0,0,0,0,0,quần mỏng mát chất quá chi tuyệt_vời shop nhiệt_tình
0,0,0,0,0,0,0,1,size nhỏ qua so vơi bình thương nhỏ shop đổi lai size xxl giùm liên he chi_thu xin cảm_ơn
0,0,0,2,0,0,0,0,form không lên như hình
0,0,2,0,0,0,0,0,s phẩm nhìn khá ơn nhung shop gửi màu đỏ nhìn không thích lam ti kí giao hàng nhanh nhiệt tinh nổi chung s phẩm trong tam_gia
3,3,0,0,3,0,0,0,áo vải đẹp đóng_gói cẩn_thận giao hàng thân_thiện áo khá dài mình cao 1m7 năng 47kg mặc size l vừa đẹp lần sau sẽ ủng_hộ shop
0,3,3,0,0,0,0,0,sản_phẩm tốt y hình mặc thoải_mái không cộm giao hàng nhanh lần sau sẽ tiếp_tục ủng_hộ shop
0,0,0,2,0,0,0,0,áo trung quốc mà_lại nhận việt_nam
0,0,0,0,0,2,0,0,sản_phẩm rất ok với giá tiền mọi người nên mua nhé sẽ ủng_hộ shop lâu_dài
0,3,0,0,0,0,0,0,shop giao hàng nhanh sử dung rất hài_lòng
0,1,0,0,0,0,0,0,chờ 2 tháng giãn cách hơn mới được giao mình mua 34 lần rồi vì mặc rất dễ_chịu
3,0,0,0,0,0,0,0,quần đẹp so với giá tiền
3,0,0,0,0,0,0,0,váy đẹp
0,0,3,0,0,0,0,0,quần tốt với tầm giá
3,3,0,0,0,0,0,0,quần đẹp vừa_vặn mặc êm shop giao hàng nhanh
0,0,0,2,0,0,0,0,tôi rất thích sản_phẩm này
3,0,0,0,0,0,0,0,hàng đẹp màu tươi_sáng dễ_thương
0,0,0,0,0,0,0,1,quần quá chật mặc khó_chịu
3,3,3,0,0,0,0,0,giao hàng nhanh nhân_viên giao hàng thân_thiện dễ_thương sản_phẩm giống mô_tả vải đẹp mặc mát
0,0,0,0,0,0,0,1,áo hơi ngắn
1,0,0,0,0,0,0,0,quần mỏng nhẹ mặc bị nhăn
0,0,0,2,0,0,0,0,hàng như mô_tả trên tiki dùng ổn tiếp_tục ủng_hộ shop
0,0,0,2,0,0,0,0,mặc rất thích mua lần 2
0,0,0,2,0,0,0,0,chất_lượng tốt
0,0,0,2,0,0,0,0,giao không đúng size
0,0,3,0,0,0,0,0,sản_phẩm tốt dày_dặn
3,0,0,0,0,3,0,0,em mới nhận được hàng phải nói ưng hết_sức quần đẹp mà_lại giá rẻ
0,0,3,0,0,0,0,3,dì mình 53kg lựa_chọn size l vừa người luôn và dì mình rất thích chất vải mỏng nhẹ mặc lên rất vừa dáng
0,0,3,0,0,0,0,3,quần ôm sát nhưng lại cho cảm_nhận rất dễ_chịu
0,0,0,0,0,0,0,1,tôi đặt 2 áo đen nhưng shop giao 1 đen 1 trắng đặt cỡ s nhưng áo không ghi cỡ rộng như cỡ m
3,0,3,0,0,0,0,0,quần đẹp vải mịn và mát thoải_mái shop giao đúng size số_lượng màu_sắc yêu_cầu
3,0,3,0,0,0,0,0,áo mặc rất mát rất dễ_chịu với da phối chân váy hay quần_jean đều đẹp nói_chung áo đơn_giản mà đẹp
1,0,0,0,0,0,0,0,màu sắt không như hình
0,0,0,2,0,0,0,0,sản_phẩm ok sẽ ủng_hộ shop
0,0,0,0,0,0,0,1,ok mình mua size l nên rộng
3,0,3,0,0,0,0,0,sản_phẩm mềm đẹp
3,0,0,0,0,0,0,0,chất đẹp
0,0,0,2,0,0,0,0,ok kiểu đơn_giản không lỗi mốt
3,0,3,0,0,0,0,0,chất vải tốt hàng đẹp hình sao thì áo như vậy mặc cũng rất đẹp
0,0,0,2,0,0,0,0,hai long
0,3,3,0,0,0,0,0,mặc thoải_mái dễ_chịu nên mua
0,0,1,0,0,0,0,0,vải của nó nhìn rất cũ
0,0,0,0,0,0,0,1,ok size hơi nhỏ cần cân_nhắc mua lên 1 size
3,0,0,0,0,0,0,0,chất áo đẹp màu như hình
3,0,3,0,0,0,0,0,áo đẹp vải mặc mát hình in sắc nét sẽ mua thêm
0,0,0,2,0,0,0,0,cực
0,0,3,0,0,3,0,0,quần su mát lạnh cực thích mua ngay đợt giảm_giá chỉ 169k 10 cái lận giá rẻ bèo luôn
3,0,3,0,0,0,0,0,chất vải siêu nhẹ màu bên ngoài nhìn rất đẹp so với ảnh rất hài_lòng
0,3,0,0,0,0,3,0,hài_lòng giao hàng nhanh shop nhiệt_tình shipper vui_vẻ đánh_giá 5 sao
3,0,0,0,0,0,0,0,áo giống hình_mẫu lên dáng đẹp
0,0,0,2,0,0,0,0,mặc vào nó phèo tùm_lum chỗ bóp dưới thì nó sẽ phèo trên thôi
0,0,2,0,0,0,0,0,chất vải bình_thường vải cũng bình_thường
1,0,1,0,0,0,0,0,mỏng đường may không chắc_chắn cân_nhắc trước khi mua
0,0,0,2,0,0,0,0,xinh xỉu luôn mình thử mặc thấy vừa ta nha hình_thức thì khỏi bàn luôn
0,0,0,0,0,0,0,3,vừa_vặn theo size hợp người lớn_tuổi
0,0,0,2,0,0,0,0,cực_kỳ ưng_ý
0,0,0,2,0,0,0,0,đơn_giản là mua thu thôi
0,0,3,0,0,0,0,0,mát thoải_mái
3,0,0,0,0,0,0,0,đẹp so với giá tiền
0,0,1,0,0,0,0,0,kém chất_lượng không giống hình
0,0,1,0,0,0,0,0,vải mỏng quá không mặc được
3,0,0,0,0,0,0,0,hàng đẹp như hình rất thích
0,0,3,0,0,0,0,0,hàng chất_lượng mặc mát thấm hút mồ_hôi tốt được tặng quà bất_ngờ shop uy_tín
2,0,3,0,0,0,0,0,chất_liệu quần_lót mềm co_giãn mình nhận hàng đúng y_như hình cảm_ơn shop nha
0,0,3,0,3,0,0,0,sản_phẩm ưng_ý đóng_gói đẹp mặc mát lắm cảm_ơn shop mình sẽ tiếp_tục ủng_hộ shop
0,0,0,0,0,0,0,1,size xl vòng 3 98 mặc vẫn chật sản_phẩm không có nhãn_mác nhà sản_xuất và xuất_xứ
3,0,0,0,0,0,0,0,hàng đẹp có lót phần trên áo_dài kín_đáo shop dễ_thương vui_vẻ đổi hàng khi mặc không vừa
