appearance,delivery,fabric_quality,others,packaging,price,service,size_fit,processed_text
2,0,0,0,0,0,0,0,mặc để role play thì được chứ mặc để sexy thì hơi bình_thường
3,0,0,0,0,0,0,0,chất_liệu vải đẹp đường may chuẩn chỉ bình_thường mình mặc size l nhưng đồ bơi mặc 2xl vừa đẹp
0,0,0,2,0,0,0,0,mình mua bộ quần_dài và áo_dài nhưng shop lại giao cho mình bộ ngắn shop làm_ăn thế này khác gì khách_hàng đâu
0,3,0,0,3,0,0,0,giao hàng siêu nhanh đóng_gói cẩn_thận đã mua 2 lần mặc cực thích
0,0,3,0,0,0,0,0,lâu rồi mới đặt_hàng online mà mua phải hàng ưng_ý quá trời chất_liệu của quần là loại vải thun lạnh sờ vào thích lắm nha mặc ôm sát mông luôn không bị cấn đâu nha mọi người sẽ giới_thiệu bạn_bè ủng
0,0,0,0,0,0,0,1,áo_rộng so với size dáng tay dơi
0,0,0,0,0,0,0,1,4050kg mặc vào bơi trong quần luôn khuyến_nghị cho người 55kg trở_lên
0,0,3,0,0,0,0,0,ok mặc mát
3,0,3,0,0,0,0,0,áo đẹp lót mỏng mặc vào rất êm
0,0,0,0,0,0,0,1,không hài_lòng form áo thì to form quần thì bé đệm ngực không chắc_chắn dễ xộc_xệch không đảm_bảo khi bơi
3,3,3,0,0,0,0,1,kiểu_dáng đẹp mặc thoải_mái form hơi nhỏ giao hàng nhanh
3,0,3,0,0,0,0,0,quần đẹp đường may đẹp vải co_giãn mặc thoải_mái lắm
3,0,3,0,0,0,0,0,hàng đẹp chất_lượng cao mình đặt_hàng nhầm size shop hỗ_trợ đổi trả nhiệt_tình thêm 1 sao
1,0,0,0,0,0,0,0,đường chỉ không tốt
3,0,0,0,0,0,0,0,hàng nhìn đẹp màu cũng dễ_thương chất_lượng ổn so với giá
0,0,0,2,0,0,0,0,ok tuyệt_vời
0,0,3,0,0,0,0,0,hàng giống mẫu chất cotton nên rất thích đúng như mong_đợi
0,0,0,2,0,0,0,0,form không như hình
0,0,3,0,0,0,0,0,vải rất êm
0,0,3,0,0,0,0,0,sản_phẩm mềm_mại mặc thích lắm ạ
0,0,0,0,0,0,3,0,shop giao đúng loại hàng đã mua thanks shop
0,0,0,2,0,0,0,0,5 sao cho chất_lượng sản_phẩm
0,0,3,0,0,0,0,0,chất_liệu vải mềm_mại
0,0,1,0,0,0,0,0,áo không được tốt so với quảng_cáo
3,0,0,0,0,0,0,0,đẹp thích mua ngưu lan sẽ ung ho tiếp
0,0,0,2,0,0,0,0,tôi mua 3 chiếc 3 màu thì màu tôi thích nhất bị những vết dơ như hình đề_nghị lần sau đừng giao hàng kiểu đó mất thời_gian của khách_hàng
0,0,0,2,0,0,0,0,sản_phẩm ok 5 sao gửi cho shop
3,0,3,0,0,0,0,3,màu đen trơn đẹp chất_liệu co_dãn mịn mỏng mát ôm_chân rất vừa_vặn mét 65 nặng 50kg vừa khít
0,0,0,0,0,0,0,1,quần mặt hơi chật size hoi nhỏ đối_với mình
0,0,0,0,0,0,0,1,mình m hài_lòng lắm vì shop bảo là size xl mặc rộng nhưng không ngờ mình còn mặc trật
3,0,3,0,0,0,0,0,chất vải đẹp thật_sự mặc rất thích thoải_mái lắm ý
1,0,0,0,0,0,0,0,không đúng như mô_tả theo hình áo ngắn 20cm mặc vừa đến chân ngực không dài đến phần eo bụng rất xấu chất_liệu vải có_thể đúng với giá_cả nhưng kích_cỡ phải đúng như mẫu quảng_cáo mới được
3,0,3,0,3,0,0,3,mình mua áo của goking cũng được vài lần lần nào đồ cũng ưng form đẹp vải đẹp đường may đẹp bao_bì đẹp có cả thư cảm_ơn nữa sẽ ủng_hộ tiếp
3,0,0,0,0,0,0,0,hàng đẹp lắm
0,0,0,0,0,0,0,1,size xl ma nhỏ qua không đúng size
0,0,1,0,0,0,0,0,co_giãn quá nhiều mặc không thích bằng loại quần_đùi
0,0,3,0,0,0,0,0,rem mềm sờ mát_tay mỗi cái là cái dây hàng mét phải cắt bớt đi khâu lại cho vừa người nếu không vậy sẽ trông giống như mặc một cái bao_tải vào người vậy
0,0,0,2,0,0,0,0,giặt xong áo bị có lại khoảng dưới 45 kg mới mặc được
3,0,0,0,0,0,3,0,sản_phẩm bận lên rất đẹp shop tư_vấn nhiệt_tình sẽ ủng_hộ shop
0,0,0,0,0,3,0,0,nhận được hàng quá bất_ngờ luôn không ngờ được hàng giá rẻ vậy mà chất_lượng rất tốt rất đáng tiền nên mua nhé mọi người
3,0,3,0,0,0,0,0,hình hứng dừa đẹp sản_phẩm mặc mát đúng 100 cotton vote 5s
3,0,0,0,0,3,0,0,bền rẻ đẹp nên mua nhé
0,0,0,0,0,0,0,3,sản_phẩm y hình mình 40kg mặc vừa luôn nha
0,0,0,0,0,0,0,1,tất_cả đều oke ạ chỉ có điều mình khá gầy nhưng mặc vẫn hơi ôm dù đã đặt size l
3,3,3,0,0,0,0,0,giao hàng siêu nhanh ạ đặt từ hôm_qua hôm_nay đã nhận được hàng trong khi shop ở tphcm quần siêu xinh chất vải mềm mát mặc rất dễ_chịu sản_phẩm_chất_lượng đáng đồng_tiền mặc lên rất sexy giao
0,0,0,2,0,0,0,0,mình đặt combo 10 quần nhưng shop giao toàn màu đen
0,0,0,2,0,0,0,0,dùng chất_lượng rồi
0,0,0,0,0,3,3,0,mua được giá phải chăn chất_lượng cũng ok nè shop rất tinh_tế che tên sản_phẩm lại sẽ ủng_hộ shop dài_dài nè shop nhắn_tin hỏi các kiểu nhận hàng ưng cái bụng ghê
0,0,0,0,0,0,3,0,đặt hôm trước hôm sau có hàng shop trả_lời nhanh thân_thiện rất có thiện_cảm với shop bạn
0,0,2,0,0,0,0,0,vải tạm ổn so với mức giá
3,0,3,0,0,0,0,1,áo đẹp vải tốt chắc do áo lớn hay mình gầy quá nên mặc có vẻ rộng
3,0,3,0,0,0,0,0,vải đẹp mặc thoải_mái sẽ đặt tiếp
0,0,0,2,0,0,0,0,sản_phẩm tốt rất đáng đồng_tiền bát gạo
0,0,0,2,0,0,0,0,mình mua dùm bạn nên cũng không biết nói_gì
3,0,0,0,0,0,0,0,cực đẹp luôn
3,0,0,0,0,0,0,0,áo đẹp phù_hợp với bà bầu và cho con bú phần form dáng có_thể không mượt_mà để mặc áo ngoài trơn và ôm
0,0,3,0,0,0,0,0,hàng tốt như tầm giá vừa size thun co_dãn tốt áo may có lót mặc ấm
3,0,1,0,0,0,0,0,đẹp như hình chỉ có chất_liệu vải không ổn lắm
3,0,3,0,0,0,0,0,quần mặc nhẹ vải đẹp
1,0,0,0,0,0,0,0,không đúng mẫu vai không đẹp
0,3,0,0,0,0,0,0,đồ khá ổn giao đúng hẹn
0,0,0,2,0,0,0,0,hàng tốt nhé
3,0,0,0,0,0,0,0,chất vải ok đẹp nhưng không có size s
3,0,1,0,0,0,0,0,chất vải hơi dày và khi mặc bị có xát ạ nhưng mà form áo rứt đẹp luôn
0,0,0,2,0,0,0,0,giao sai size đặt size m mà shop giao size l quần thì đã bị cắt mác
0,0,0,2,0,0,0,0,ok à
0,0,0,2,0,0,0,0,màu_sắc như quảng_cáo mặc nhà cũng tiện_lợi xứng_đáng với tiền bỏ ra
0,0,0,2,0,0,0,0,áo mình mua màu kem mà ship màu trắng nhưng nhìn cũng ok
0,3,0,0,0,0,0,0,giao hàng nhanh còn sản_phẩm chưa dùng nên chưa biết thế_nào
0,0,0,2,0,0,0,0,sản_phẩm cũng được nhưng size không phù_hợp với cách tính
0,0,0,0,0,0,0,1,áo khá ổn với giá tiền nhưng lại có vết này mình không biết giặt có ra không mình đặt 2 cái đúng màu size thì tạm ok chắc do mình nhỏ người nên hơi rộng cảm_ơn shop
3,3,2,0,3,0,0,3,quan đẹp vua van vai cũng tam được không qua xấu giao hàng nhanh đóng_gói cẩn than
3,3,0,0,0,0,0,0,hàng đẹp lắm ạ giao hàng nhanh nhận mà quá hài_lòng luôn
0,0,3,0,0,0,0,0,chất_lượng rất tốt đã dùng 10 năm hiệu này rồi chưa có ý_định thay hiệu khác
0,0,3,0,0,0,0,0,vải đẹp mặc mát
3,0,0,0,0,0,0,0,sản_phẩm đẹp tốt
3,0,3,0,0,0,0,0,chất_liệu nhìn ổn mẫu đẹp không biết mặc vừa không
0,0,0,0,3,0,0,0,hàng được đóng_gói cẩn_thận chất_lượng cũng ok lắm
0,0,0,2,0,0,0,0,mặc được
0,0,0,2,0,0,0,0,áo rất tệ mình nghĩ là không nên để shop này bán trên app vì không mang lại niềm vui cho khách_hàng
0,0,0,2,0,0,0,0,cứ yên_tâm mà mua
0,0,0,0,0,0,3,0,shop hỗ_trợ đổi trả nhanh_nhẹn nhiệt_tình
0,0,0,2,0,0,0,0,quần chất_lượng quá tốt so với giá mỗi tội không có túi nên mặc hơi bất_tiện xíu
0,3,1,0,0,0,0,0,hàng giao nhanh hơn dự_kiến nhưng khi xem áo có vài chỗ bị dính màu vải bông bên trong hơi mỏng nói_chung cũng được
0,3,0,0,0,3,0,0,hàng chất_lượng tốt co_giãn giao hàng nhanh đúng mẫu giá_cả hợp_lý
3,0,0,0,0,0,0,0,đường may chắc_chắn quần đẹp
0,0,0,2,0,0,0,0,chất_lượng quá kém sẽ không bao_giờ mua lại
3,0,3,0,0,0,0,0,áo này đệm dày nè nâng ngực tạo khe ok lắm có gọng ôm ngực không bị xệ chị_em nên mua nếu muốn nâng ngực nha
3,0,0,0,0,0,0,0,đẹp nhưng hơi nhỏ
0,0,0,2,0,0,0,0,dùng ok nha
3,0,0,0,0,0,0,0,đẹp chim ưng
2,0,0,0,0,0,0,3,quần giống trong hình mình mặc vừa ok
3,0,0,0,0,0,0,0,đường may đẹp
0,3,0,0,0,0,0,0,chất_lượng sản_phẩm tốt giao hàng siêu nhanh
0,0,0,0,0,0,0,3,sản_phẩm ok nhưng giao size xxl hơi rộng so với mình nhưng hài_lòng
3,0,3,0,0,0,0,0,co_dãn tuyệt_đối vải mỏng mịn mát ôm sát mặc lên rát đẹp cạp cao_qua_rốn
3,0,0,0,0,0,0,0,áo thun đẹp
0,0,0,2,0,0,0,0,mặc vào vẫn tuột như_thường ạ
3,0,3,0,0,0,0,0,quần rất đẹp chất thun cotton mềm mịn
3,0,0,0,0,0,0,0,hàng đẹp
0,3,3,0,0,0,0,0,sản_phẩm_chất lương tốt giao đúng hẹn
0,0,0,2,0,0,0,0,lưng quần thêm 4 cm đúng 63 kg nhưng không được nên trả lại
3,0,0,0,0,0,0,1,quần đẹp mình 60kg nên lấy l mình cao 1m60 nếu bạn nào muốn ôm nhé mình lấy size xl không được ôm ky sao mình mua nhỏ hơn size
0,0,1,0,0,0,0,1,size quá nhỏ tôi 50kg cao 1m52 đặt size l mà mặc không vô vải lại không co_giãn mấy không phải vải tốt
3,0,0,0,0,0,0,0,xin lắm shop giao đủ số_lượng miếng dán chắc mùa hè ai hay đổ mồ_hôi mọi người có_thể kèm thêm băng_dính cá_nhân sản_phẩm tốt
3,0,0,0,0,0,0,0,quần đẹp mặc ngủ ở nhà vẫn sang thiết_kế gọn_gàng xinh_xắn
1,0,0,0,0,0,0,0,quần vải xấu form cũng xấu mặc được đến hôm thứ 2 thì đã bị rách thật_sự thất_vọng về tiki và cửa_hàng
1,0,1,0,0,0,0,0,không ổn nha mỏng lắm với hình con gấu phía trước là in không phải như hình nhé
0,0,0,2,0,0,0,0,khá cưng
3,0,0,0,0,0,0,0,hàng đẹp như hình chất_lượng khá ổn sẽ tiếp_tục ủng_hộ shop
0,0,3,0,0,0,0,0,mềm nhẹ mặc dễ_chịu
0,0,0,2,0,0,0,0,lần nào mua hàng cũng ưng_ý ạ chất_lượng không bao_giờ thất_vọng yên_tâm khi mua bên shop
3,0,0,0,0,0,0,0,quần siêu đẹp mình 52kg cao m58 chân mình to hơn so với người mặc size 30 vừa nhé
0,0,0,2,0,0,0,0,giống hình
0,0,0,0,0,0,0,1,mình không nhìn kỹ nên đặt giờ quần quá lớn mà mình có 46kg mặc 2 người mới vừa tiếc vải so với giá thì ok
1,0,0,0,0,0,0,0,không giống trong ảnh quá xấu
0,0,3,0,0,0,0,3,chất_lượng rất tốt đúng size đã sử_dụng trên 10 năm hiệu này rồi chưa có ý_định thay_đổi hiệu khác
0,3,3,0,0,0,0,3,quần rất mát vừa_vặn với mình giao nhanh_chóng đủ số_lượng đã đặt
0,0,0,2,0,0,0,0,mua tặng vợ
0,0,0,2,0,0,0,0,giao sai size đặt l mà giao xxl
3,0,0,0,0,0,0,0,hàng đẹp chuẩn
0,0,3,0,0,0,0,0,giống hình 5 sao chất_liệu hài_lòng 4 sao tiki phục_vụ tốt 5 sao thanks
0,0,0,0,0,0,0,1,đặt size mà nó giãn như xxl không mê
0,0,1,0,3,0,0,0,giống hình vải có_vẻ co_giãn nhưng hơi nóng chắc do lúc nhận hàng trời nắng gói hàng đẹp giấy gói đẹp ghê
3,0,3,0,0,0,0,3,quần ôm hết mông vải nhẹ_tênh không hề có chỉ thừa rất đẹp tại điện_thoại mình chụp hình không đẹp chứ ở ngoài màu đẹp lắm
3,0,0,0,2,0,0,0,giao hàng hơi chậm do dịch nhưng không sao quần đẹp mát mỏng nhẹ_nhàng mỗi quần để trong 1 túi rất lịch_sự nhưng theo mình là không cần_thiết thành_phần là 90 spandex mua size xl mẹ mình rất thích
0,0,1,0,0,0,0,0,chất_liệu vải bị đổ màu rất nhiều
3,0,3,0,0,0,0,0,chất_liệu vải rất tốt áo rất ấm và đẹp
0,0,0,2,0,0,0,0,nếu có nhãn riêng thì nên dùng đừng nhái nhãn_hiệu trá_hình đảo chữ kỳ_cục thì tốt hơn
3,0,0,0,0,0,0,3,mua đi mấy chị_em thề là đẹp và vừa như in
3,0,0,0,0,2,0,1,sản_phẩm ok lắm chất_liệu đẹp so với giá tiền nhưng nói thật rộng quá size m mà như xl
0,0,3,0,0,0,0,0,sản_phẩm có chất_lượng tốt đã mua nhiều lần tại shop rồi nên mua dùng nha mọi người mình chỉ gợi_ý thôi nha ủng_hộ shop 5 sao và shipper 5 sao nha
3,0,3,0,3,0,0,0,vải đẹp mẫu y_như hình co_giãn tốt đồ bơi có túi zip đẹp tiện_lợi khi đi bơi
0,0,3,0,0,0,0,0,tốt mịn
3,0,0,0,0,0,0,0,nhận được hàng mừng quá áo vải đẹp mà vừa túi_tiền
3,0,3,0,0,0,0,0,sản_phẩm tốt_đẹp ấm
2,0,0,0,0,0,0,0,tay_áo bị dài ạ
3,3,0,0,0,0,0,0,quần rất đẹp ạ giao hàng siêu nhanh đặt ngày 23 24 đã nhận được chiều dài quần khá lý_tưởng cho các bạn 16m trở lên lần thứ 2 mình mua rồi thanks shop
2,0,0,0,3,0,0,0,sản_phẩm như mẫu ạ đóng_gói về cũng cẩn_thận lần sau sẽ ủng_hộ tiếp
0,0,0,0,0,0,0,3,chất_liệu y hình mặc rất thoải_mái
0,3,3,0,0,0,0,0,giao hàng nhanh tốt vải mềm có che tên sản_phẩm ok
3,0,3,0,0,0,0,0,chất_liệu vải tốt kiểu_dáng như hình shop rất uy_tín
0,0,0,2,0,0,0,0,đừng mua tiền nào của đó
0,1,0,0,0,0,0,0,sản_phẩm tốt nhưng bên vận_chuyển_giao hàng hơi lâu
3,3,0,0,0,0,0,0,màu đỏ đồ đẹp mĩ_mãn nhưng không bị quá trầm giao hàng nhanh shipper nhiệt_tình vui_vẻ biết mình làm ca đêm ban_ngày phải ngủ nên mãi chiều_tối mới giao_cảm_ơn
0,0,0,2,0,0,0,0,cũng ok lắm nhé mọi người ơi mua mua đi nhé
0,0,3,0,0,0,0,3,đúng size như mô_tả vải tốt và co_giãn khá hài_lòng sẽ ủng_hộ tiki nữa
0,0,0,2,0,0,0,0,dịch_vụ sau bán hàng cực_kỳ kinh_dị kiểu như_không cần và đuổi thẳng khách mình mua 4 đơn có 1 đơn size nhỏ và có nhu_cầu đổi trả cũng như mua thêm 2 đơn tiếp đợi báo_giá gọi điện không phản_hồi gì
1,0,0,0,0,0,0,0,quấn quá xấu đường mai ẩu tia kéo cũng dở_đồ bỏ đi
3,0,0,0,0,0,0,0,sản_phẩm đẹp như hình quảng_cáo chưa sử_dụng nên chưa thể đánh_giá chất_lượng
0,0,0,2,0,0,0,0,với mức giá tiền như vậy chất_lượng liệu form dáng rất được
2,0,0,0,0,0,0,0,khoác mùa hè thì hơi nóng màu_sắc giống hình
0,0,3,0,0,0,0,0,vài dày co_giãn tốt đáy quần hơi ngắn và ống quá nhỏ nên khó mặc
0,0,0,2,0,0,0,0,hài_lòng đã mua rất nhiều lần
2,0,3,0,3,0,0,0,chất vải sờ rất thích đóng_gói sản_phẩm ok nhận hàng như mẫu
0,0,0,0,0,0,0,1,size nhỏ hơn các hãng khác
0,0,0,2,0,0,0,0,hàng nhận khác hình chụp không giống mô_tả không biết shop có giao nhầm mẫu không
1,0,1,0,0,0,0,0,quần bình_thường không lung_linh như mọi người ca_tụng phù_hợp với giá tiền chỉ may và dây kéo khác màu với vải quần quần vải dày mà dây kéo nhỏ_xíu không phù_hợp
0,3,0,0,3,0,0,0,giao đúng size mặc được shop đóng_gói cẩn_thận thời_gian giao hàng rất nhanh
0,0,3,0,0,3,0,3,đã mặc 1 ngày vải rất mịn mặc rất mát size vừa giá vậy là hợp_lý lắm rồi
2,0,0,0,0,0,0,0,sản_phẩm như hình
0,3,0,0,0,0,0,0,đồ bơi nữ hai mảnh đa_năng at168 khá ok giao hàng nhanh
0,0,0,0,0,0,0,1,form hơi nhỏ
3,0,0,0,0,0,0,0,ok đo đẹp phù_hợp nhu_cầu sử_dụng
3,0,0,0,0,0,0,0,đẹp nha mọi người
0,0,0,2,0,0,0,0,đặt 2 cái 190k giờ về có 1 cái van 190k
3,3,0,0,0,0,0,0,quần đẹp xinh shop chuẩn_bị hàng và giao hàng rất nhanh
0,0,0,2,0,0,0,0,ổn tiện cho mặc váy không dây
0,0,0,2,0,0,0,0,người gầy gầy mặc sẽ ổn hơn
0,0,0,0,0,0,0,1,chất_lượng và mẫu_mã sản_phẩm rất ok chỉ tiếc là mình mặc hơi chật tí có size 42 chắc ok
2,0,3,0,0,0,0,0,cạp cao_qua rốn vải mướt_mềm
0,0,0,0,0,0,0,1,quần mua size l nhưng nhỏ mọi người nên lưu_ý
3,0,0,0,0,0,0,3,mặc rất vừa_vặn và đẹp
3,0,3,0,0,0,0,0,may kỹ vải đẹp
0,0,3,0,0,0,0,0,vải mền mịn chất_liệu mát
0,0,3,0,0,0,0,0,mua 2 set đều về đúng ý tông màu basic như hình nên khá ưng quần mặc thoải_mái co_dãn tốt gân viền không cấn đau da tính ra mua cũng 67 set quần này của shop rồi và dự là tiếp_tục dùng lâu_dài nếu
0,0,0,2,0,0,0,0,dùng thấy ok
1,0,0,0,0,0,0,1,áo không giống hình_ảnh sản_phẩm quá xấu form rộng
0,3,0,0,3,0,0,0,giao hàng nhanh đóng_gói kĩ rất ưng sản_phẩm bên shop nhé
0,0,0,0,0,3,3,0,ở đây shop bán hàng giá rẻ mà rất tận_tâm nữa luôn mình mua quần thì ổn áo thì lộn mất size 3680 nên hơi rộng nhưng nhận hàng rồi nên cũng ngại đổi trả có điều shop rất nhiệt_tình hỗ_trợ đổi trả nên
0,3,0,0,0,0,0,0,mua cho cháu tui cũng không rõ giao nhanh
0,0,3,0,0,0,0,0,vải đẹp mặc mát hi_vọng có nhiều màu để lựa_chọn hơn
0,0,0,0,0,0,0,1,mình vừa mua nhưng bị chật mình muốn đổi size thì phải làm thế_nào ạ
0,0,1,0,0,0,0,0,chất vải thô giáp không phù_hợp với đồ lót
0,0,0,2,0,0,0,0,đặt màu này giao màu khác haiz
0,0,0,2,0,0,0,0,hài_lòng sản_phẩm như mô_tả số_lượng 5 chiếc giá_cả hợp_lý ưng_ý hộp cũng đẹp thanks shop
3,0,3,0,0,0,0,0,kiểu giáng đẹp chất_liệu vải tốt tiếp_tục ủng_hộ shop
3,0,3,0,0,0,0,0,đẹp min ấm nhẹ mặc moi ngay là
3,0,0,0,0,0,0,0,co dây điều_chỉnh mặc rất thích phối áo ống đồ không dây đẹp lắm ạ
3,3,0,0,0,0,0,0,hàng đẹp shop giao_hỏa_tốc nhanh thật đó ạ chất_lượng sản_phẩm ok nên mua nha các bạn
0,0,3,0,0,0,0,0,vải mềm mặc thoáng chất_liệu oke
0,3,0,0,3,0,0,0,sản_phẩm đóng_gói chắc_chắn giao hàng nhanh giá_thành thì khá rẻ chất_liệu mát
0,0,0,2,0,0,0,0,may ổn chất_lượng ổn so với giá tiền
0,0,0,0,0,0,0,1,hơi chật
3,0,3,0,0,0,0,0,áo đẹp vải tốt 5
3,3,3,0,0,0,0,0,màu trắng rất đẹp vải mịn mát giao hàng vui_vẻ 6 sao
3,0,0,0,0,0,0,0,rất đẹp nhé
0,0,3,0,0,3,0,0,quần mặc mát tuy_nhiên 5 cái quần không may vải như nhau với giá tiền rẻ thì mình thấy hài_lòng rồi
3,0,0,0,0,0,0,1,đồ đẹp nhưng hơi bé
0,0,3,0,0,0,0,0,mặc rất thích nha
0,0,3,0,0,0,0,3,chất_liệu vải tương_đối ok tuy không bằng 1 số thương_hiệu nổi_tiếng khác nhưng vừa với tầm giá size chuẩn
0,0,1,0,0,0,0,0,không co_giản
0,0,0,2,0,0,0,0,hốt nhanh em này để_dành mặc đầm dây áo ống nha chị_em rất ok đó
3,0,3,0,3,0,0,0,chất_lượng vải ok hút mồ_hôi tốt may thì đôi chỗ còn chưa ok lắm nhưng nói_chung cũng tạm ổn đóng_gói đẹp hình in đẹp sắc nét
0,0,3,0,0,0,0,0,chất_lượng tốt nên đánh_giá 5 sao lười chụp ảnh
0,0,1,0,0,0,0,0,chất dở tệ phí tiền khi mua
0,0,0,2,0,0,0,0,áo 2xl mới vừa với mình hôm bữa không biết mua xl hơi chật chất_liệu vải giống áo polo
0,0,3,0,0,3,0,0,quần mặc mát giá rẻ phù_hợp với giá tiền mình rất thích
0,0,0,2,0,0,0,0,đúng như giới_thiệu sản_phẩm
3,0,3,0,0,0,0,0,vải mềm mịn đẹp mặc thêm quần lửng bên trong ngồi cũng không sợ chật cảm_ơn shop và tiki
0,0,0,0,0,0,0,1,phần nách hơi rộng lên nhìn rõ áo bên trong
0,0,0,0,0,0,0,1,quần ôm chặt quá không thoải_mái lắm vải ổn
0,0,3,0,0,0,0,0,mình đã mua bộ này vải rất tốt giặt không bai nhão không xù mình mê đồ tắm mua nhiều nhưng bộ này mình thích và mặc nhiều nhất
0,0,0,2,0,0,0,0,quá tốt
0,0,3,0,0,3,0,0,chất mềm giá sale rẻ hài_lòng
0,0,0,2,0,0,0,0,áo_phông chất_lượng sẽ mua thêm 1 cái nữa
0,0,0,0,0,0,0,1,đặt mua size xxl mà áo nhỏ_xíu người 40 kg mặc còn không vừa huống_chi mình 64 kg
3,0,0,0,0,0,0,0,sản_phẩm đẹp đúng như mô_tả nhiều màu rất thích sản_phẩm này sẽ mua tiếp
0,0,0,2,0,0,0,0,mình mua nhưng hơi rộng shop có_thể hỗ_trợ hạ size hoặc đổi size bé hơn được không chất_lượng tốt
0,0,0,0,0,0,0,1,có vẻ size bị nhầm nhỏ hơn 1 size mình có_thể đổi lại không shop
0,0,3,0,0,0,0,0,chất_liệu như hình vải thoáng mát
0,0,0,0,0,0,0,3,chất_lượng tuyệt_vời size chuẩn ạ
3,0,0,0,0,0,0,3,quần đẹp xỉu vừa in luôn mọi người nên mua nhỏ
1,0,0,0,0,0,0,0,xinh đúng màu mà chỉ thừa hơi nhiều vẫn sẽ ủng_hộ nha
3,0,0,0,0,0,0,0,ok sexy
0,0,0,2,0,0,0,0,nói đổi size mà không đổi không uy_tín
3,0,0,0,0,0,0,0,tốt hàng đẹp vừa túi_tiền
3,0,0,0,0,0,0,0,sản_phẩm đẹp đường may tốt nên mua
0,0,0,0,0,0,1,0,đặt hình khác gửi nhầm mau shop lam an kí_vậy
1,0,0,0,0,0,0,0,sản_phẩm không giống hình_dáng quần thực_sự quá xấu không có túi bên khoá giả túm lại la thất_vọng
0,3,3,0,3,0,0,0,đóng_gói rất cẩn_thận giao nhanh chất_liệu thu dày mát màu hồng kết_hợp với xanh đen trẻ_trung có cả khung kim_loại nâng ngực nữa nói_chung hợp_ý tui
0,0,0,2,0,0,0,0,sản_phẩm năm sao đáng_giá mình đợi 1111 giảm_giá để mua thêm 1 bộ nữa cho chị m thanks nhé
0,0,0,0,0,0,0,1,quần hơi rộng không đúng kích_thước so với kg như size 3xl
0,0,0,0,0,3,0,0,giá phải chăng chất_lượng tốt
0,0,0,2,0,0,0,0,sản_phẩm tốt hơn mong_đợi shop làm_ăn uy_tín lắm mọi người nên mua nha
0,0,0,2,0,0,0,0,sản_phẩm khá ổn
3,0,0,0,0,0,0,0,rất hài_lòng sản_phẩm đẹp giá hợp_lý
0,0,0,2,0,0,0,0,quần không giống hình nhiều sản_phẩm không có nhãn
0,3,0,0,0,3,0,0,ưng lắm mọi người nên mua nha mình mua của shop nhiều lần rồi không hề thất_vọng tí nào giao hàng nhanh giá rẻ
3,0,3,0,0,0,0,0,chất quần rất xịn lâu rồi mới mua được 1 cái quần đẹp và tiện_dụng đến vậy
0,0,0,2,0,0,0,0,sản_phẩm ok à
0,0,3,0,0,0,0,0,mỏng nhẹ thoáng mát mặc không bị lộ viền khá thoải_mái
3,0,0,0,0,0,0,0,áo đẹp giao giống trong hình giao nhanh các bạn nên tham_khảo nhé
3,0,3,0,0,3,0,0,màu_sắc đa_dạng chất vải được giá quá hợp_lí
0,0,0,2,0,0,0,0,chất_lượng tốt minh mua size shop tư van mặc thoải ok lam minh sẽ mua nua
0,0,0,2,0,0,0,0,không_thể hài_lòng hơn với giá tiền như_vậy
0,0,0,0,0,0,0,3,nâng ngực tốt ôm bầu ngực nhỏ gọn tiện_lợi vô_cùng
0,0,0,2,0,0,0,0,ok ok
0,0,1,0,0,0,0,1,không đúng size chất_lượng vải không ok
0,0,0,2,0,0,0,0,sản_phẩm giao lộn size đặt size m mà giao size l
0,0,0,0,0,0,0,1,quần dài rộng mà vừa quê
0,0,3,0,0,0,0,0,quần vải rất rất thích co_giãn cực_kỳ tốt sờ mát_tay nữa rất hài_lòng luôn đó
1,0,1,0,0,0,0,0,quần_lót quá mỏng ra màu mình không dám mặc luôn
3,3,0,0,0,0,0,3,áo mặc vừa đẹp nhân_viên giao hàng nhanh
0,0,0,2,0,0,0,0,rất ưng
0,3,3,0,0,0,0,0,giao hàng nhanh sờ vải mịn chưa sử_dụng nên chưa biết có bền mình nghĩ tiền nào của nấy
0,0,2,0,0,0,0,0,vải nó không co được đẹp ok
0,0,3,0,0,0,0,0,dùng khá ổn thoải_mái chất_lượng tốt so với giá tiền
0,0,0,2,0,0,0,0,thích thì mua
2,0,3,0,0,0,0,0,màu hồng không tươi hơi già mua 4 cái rồi về kiểu hay vải đều ok
0,0,0,2,0,0,0,0,hài_lòng sản_phẩm tốt
0,0,3,0,0,0,3,0,vải đẹp phục_vụ tốt
3,0,0,0,0,0,0,0,đẹp lắm
0,0,3,0,0,0,0,1,chất_liệu tốt đã mua rồi nhưng không có size xl chỉ có size m shop báo đến 62kg nhưng mình 60kg bận không vừa
3,0,0,0,3,0,0,0,nên mua áo đẹp và in rõ nét đóng_gói chỉn_chu làm_quà tặng được
3,0,0,0,0,0,0,0,dẹp ok
0,0,0,2,0,0,0,0,nhận hàng ưng_ý lắm ạ nên mua nhé các bạn
0,0,0,0,0,0,0,1,chất_lượng không như trong hình quần hơi ngắn
0,0,0,2,0,0,0,0,chất_lượng ổn so với giá tiền
0,0,0,2,0,0,0,0,muốn chech chi chính đẹp quyến_rũ thì không_thể thiếu em này phải luôn xinh_đẹp
3,0,0,0,0,0,0,2,hàng chất_lượng giống như quảng_cáo nhưng dáng dài mặc khó_chịu hơn cảm_ơn tiki nhiều
0,0,0,2,0,0,0,0,không đổi được khi đã mua rồi
0,0,0,2,0,0,0,0,đổi dùm em may do say nhỏ hơn
3,0,0,0,0,0,0,0,dễ_thương
0,3,3,0,0,0,0,3,giao nhanh mặc êm thoải_mái
0,0,3,0,0,0,0,3,giao đúng màu size ok mặc nhẹ khá mát thoải_mái
3,0,0,0,0,0,0,0,đẹp vừa_ý cảm_ơn
0,0,1,0,0,0,0,0,quần giao bị lỗi đề_nghị shop liên_hệ để được trả hàng
0,3,2,0,0,0,0,0,bình_thường giao hàng nhanh
3,0,3,0,0,0,0,0,chất_liệu áo tốt kiểu_dáng đẹp mặc tôn_dáng thoải_mái và khá bền
0,0,0,2,0,0,0,0,sản_phẩm bình_thường kiểu_dáng không giống như quảng_cáo
