appearance,delivery,fabric_quality,others,packaging,price,service,size_fit,processed_text
0,0,3,0,0,0,0,1,chất_liệu vải tốt vừa với giá tiền người giao hàng cũng ok áo to đối_với mình
0,0,0,2,0,0,0,0,hàng không đúng như hình anh vì qua nhỏ
0,0,0,2,0,0,0,0,hài_lòng với sản_phẩm
0,0,3,0,0,0,0,0,hài_lòng với sản_phẩm thun mát
3,0,3,0,0,0,0,0,đẹp mềm nâng ngực
0,0,0,2,0,0,0,0,đặt size lớn l nhưng thực_tế nhận được quá nhỏ như đồ tắm của trẻ_con
0,0,1,0,0,0,0,0,váy ngủ tạm được hơi mỏng
0,0,0,0,0,0,0,1,áo form rộng quá mình muốn đổi lại mẫu khác được không shop
0,0,0,0,0,1,0,0,giá quá đắt
3,0,0,0,0,0,3,0,rất đẹp giá tốt phục_vụ tốt
3,0,0,0,0,0,0,0,sản_phẩm rất đẹp chất vải tốt nói_chung là rất hài_lòng về sản_phẩm có dịp sẽ quay lại ủng_hộ shop các sản_phẩm tiếp_theo
0,0,0,2,0,0,0,0,sản_phẩm dễ_chịu
3,0,0,0,0,0,0,0,hàng đẹp 4 chiếc được gấp gọn_gàng để trong 1 chiếc túi zip dễ_thương sẽ tiếp_tục ủng_hộ tiki
3,0,0,0,0,0,0,3,đẹp mềm mặc thoải_mái hình minh_họa
3,0,3,0,0,0,0,0,len đẹp có cúc ngọc xinh_xinh trên cổ áo này cho ai nặng dưới 55kg thôi nha
0,0,0,2,0,0,0,0,không như mẫu quảng_cáo không được hài_lòng cho mấy
0,0,3,0,0,0,0,0,vải hơi giày dặn ai thích mỏng thì loại này chưa hợp nha
3,0,3,0,0,0,0,0,áo đẹp vải len mịn
3,0,0,0,0,0,0,0,sản_phẩm đẹp dày_dặn len from đẹp shop dễ_thương đôi size cho mình rất nhanh lần sau sẽ mua tiếp ở shop
0,0,3,0,0,0,0,3,thoáng mát co_giãn tốt mặc rất thoải_mái nên mình đã mua lại lần thứ hai
3,0,0,0,0,0,0,0,vải đẹp mặc đẹp rất thích
3,0,3,0,0,3,0,0,giá_như này quá ổn sản_phẩm đẹp mát
0,0,0,0,0,2,0,0,sản_phẩm_chất_lượng phù_hợp với giá tiền sẽ ủng_hộ shop vào lần tới best
0,0,0,2,0,0,0,0,đặt 1 màu shop giao 2 màu khác nhau
0,3,0,0,0,0,0,0,hàng giao nhanh sản_phẩm mặc rất ok lần đầu mua ma shop ma thay rất ung ý sẽ ung ho shop
3,0,3,0,0,0,0,2,kiểu_dáng đẹp đường may cẩn_thận chất_liệu tốt vừa_vặn nhưng quần hơi ngắn
0,0,1,0,0,0,0,0,chất vải tốt hơn mong_đợi đường may thiếu chắc_chắn
0,0,3,0,0,0,0,0,mình rất yên_tâm khi mua áo thun của thương_hiệu nổi_tiếng goking vải mềm đẹp mặc mát thấm hút mồ_hôi rất ok
0,0,0,2,0,0,0,0,không có gì để chê cả giá hợp_lý với chất_lượng sản_phẩm
0,0,1,0,0,0,0,0,cố_định được nhưng không lâu tầm 36 tiếng là hết dính rồi
3,3,0,0,0,0,0,0,hàng đẹp so với giá giao hàng nhanh
3,0,3,0,0,0,0,0,quần_lót đẹp chất vải mềm chỉ có gen hơi lớn
2,0,0,0,0,2,0,0,nhận hàng như mẫu sản_phẩm rất ok so với giá tiền
3,0,3,0,0,0,0,0,quần đẹp mặc co_giãn thoải_mái đóng_gói kiểu nhật bản nghệ_thuật
3,0,3,0,0,0,0,0,áo mát đẹp
3,0,3,0,0,0,0,0,rất tốt_đẹp
0,0,0,2,0,0,0,0,cảm_thấy áo không như mong_đợi
0,3,0,0,0,0,0,3,mặc vừa giao hàng nhanh
0,0,3,0,0,0,0,0,chất_liệu vải tốt giống mẫu khuyến_cáo mọi người nên mua nha
3,3,3,0,0,0,0,0,mẫu_mã đẹp chất_liệu mềm_mại mịn_màng mát thấm hút mồ_hôi tốt giao hàng nhanh
3,0,3,0,0,0,0,0,áo đẹp chất vải mềm
3,0,3,0,0,0,0,0,chất_lượng tốt mau ma_đẹp
3,0,0,0,0,0,0,0,áo đẹp lắm ạ
3,3,0,0,3,0,0,0,hàng đẹp như hình giao hàng nhanh đóng_gói ok rất hài_lòng
0,3,3,0,0,0,0,0,giao hàng nhanh chất_liệu ok tiếp_tục ủng_hộ shop
3,0,3,0,0,0,0,0,quần mặc lên rất đẹp không bị lộ ngấn mỡ vải mềm mịn không gây rát da
0,0,0,2,0,0,0,0,cũng tạm được sơ với giá tiền
0,0,0,0,0,0,0,3,bé 8 tuổi mặc vừa nha
0,0,0,2,0,0,0,0,sếch xy lắm
0,0,0,2,0,0,0,0,rất ổn
0,0,0,2,0,0,0,0,không giống ảnh nhỏ hơn với size đặt
3,0,0,0,0,0,0,0,đường may rất đẹp và kỹ cám_ơn
3,0,3,0,0,0,0,0,ok áo may đẹp vải thun dày mát mặc vào thấy rất hài_lòng và có thư cảm_ơn của shop nữa
3,0,0,0,0,0,3,0,sản_phẩm rất đẹp mặc lên vừa ưng lắm rất hài_lòng shop tâm_lý còn tăng khẩu_trang chúc shop buôn may bán đặt nhé
0,0,3,0,0,3,0,0,rẻ bền mặc siêu thích mình mua mấy cặp để mặc dần_cơ
0,0,0,2,0,0,0,0,tiền nào của nấy đừng mua hàng rẽ mua về vứt thôi à
0,0,0,2,0,0,0,0,bình_thường không co gi đặc biết
0,3,3,0,0,0,0,0,vải lạnh đường may đẹp giao hàng nhanh đúng mẫu
3,1,0,0,0,0,0,0,hàng đẹp giao hàng quá lâu gần 2 tháng mới nhận được
0,0,0,2,0,0,0,0,dùng tạm ổn
3,0,0,0,0,0,0,0,nhẹ_nhàng xinh rất hài_lòng về bộ này 5 sao luôn ạ
0,3,0,0,0,0,0,0,giao hàng nhanh chất_lượng thì sử_dụng mới biết
0,0,0,0,3,0,0,0,đóng_gói cẩn_thận
3,1,0,0,0,0,0,0,sản_phẩm rất đẹp vải rất đẹp đúng như hình đúng size đúng mẫu rất rất ưng_ý và hài_lòng shipper hơi chậm nhưng không sao tôi đánh_giá 5 sao cho shop sẽ tiếp_tục ủng_hộ
0,0,0,2,0,0,0,0,áo gửi không giống như quảng_cáo tôi muốn trả lại hàng làm_ăn vớ_vẩn quá
3,3,0,0,0,0,0,0,giao nhanh áo đẹp như hình
0,0,0,2,0,0,0,0,sản_phẩm như hình rất tốt nha
3,3,0,0,0,0,0,0,vải đẹp giao nhanh
3,0,0,0,0,0,0,0,áo đẹp xinh vải đẹp
3,0,0,0,0,0,0,0,rất hài_lòng hàng rất đẹp cảm_ơn shop tiếp_tục ủng_hộ tiki
1,0,1,0,0,0,0,0,vải khá mỏng đường chỉ may ẩu shop nói set sang_trọng mà nhìn tệ hơn đồ chợ
3,3,3,0,0,0,0,0,áo mặc thoải_mái chất vải mát dáng đẹp giao hàng sớm
3,0,0,0,0,0,0,0,đã mua cái thứ hai một từ đẹp
3,0,1,0,0,0,0,1,váy mỏng nhưng rất sexy ngực vợ mình 90 và nhìn sẽ hơi nhỏ so với đầm bạn nào mình dây và ngực vừa mặc sẽ ổn hơn
0,0,3,0,0,0,0,0,quần_lót su không đường may_mặc êm thoáng mát không gây bí
0,0,0,2,0,0,0,0,vo tôi thích lam
2,0,3,0,0,0,0,0,sản_phẩm_chất_lượng 10 cái thì có 6 cái màu nhạt xinh xỉu và 4 cái màu rực_rỡ luôn hàng giao từ sài_gòn mà nhận được rất nhanh 5
0,0,0,0,0,3,0,0,quần mặc ok lắm luôn giá lại mềm mình nghĩ nên mua nhé hình_ảnh mang tính_chất nhận xu
0,0,0,2,0,0,0,0,hàng chất_lượng
3,3,0,0,0,0,0,3,quần mặc vừa đẹp
0,0,0,2,0,0,0,0,mang body vào vòng nào ra vòng đấy rất đẹp nhé m sẽ mua thêm
3,0,3,0,0,0,0,0,quần mặc lên rất đẹp chất vải tốt hàng nhận như hình lần sau sẽ ủng_hộ shop tiếp
1,0,0,0,0,0,0,0,áo xấu kinh_khủng không có chút gì gọi là đẹp màu áo khác xa trên hình nhìn ở ngoài nhìn bẩn bẩn nói_chung là rất xấu mình khuyên mọi người không nên mua
0,0,3,0,0,0,0,3,quần mặc thoải_mái vừa_vặn rất ôm không hằn không lằn sẽ mua lần sau
0,1,3,0,0,0,0,0,hàng tốt nhưng giao hơi chậm tí
3,3,3,0,3,0,0,0,thời_gian giao hàng khá nhanh shop đóng_gói hàng khá cẩn_thận vải mềm đường may đẹp
0,0,3,0,0,3,0,0,giá tốt chất_lượng tốt đã mua lần thứ 2
3,0,3,0,0,2,0,0,chất vải đẹp thật_sự giá hợp_lý lắm ạ nên mua ạ
0,0,0,2,0,0,0,0,trắng kem nhìn_chung là phù_hợp với giá tiền
0,3,3,0,3,3,0,0,hàng y hình mềm mịn giá rẻ giao nhanh đóng cẩn_thận
0,0,0,2,0,0,0,0,giáo thiếu sản_phẩm số_lượng là 3 mà chỉ giao 2 sản_phẩm
0,0,0,0,0,3,0,0,quần lỗi ạ giá_cả hợp_lý
0,0,3,0,0,0,0,0,em nhận được hàng rồi ạ kiểm_tra sản_phẩm đúng chất vải như shop quảng_cáo rất xứng_đáng được 5 sao shop nhé sắp tới em sẽ ủng_hộ tiếp nhé
3,3,0,0,0,0,0,0,áo đẹp giao hàng nhanh_chóng lần sau lại mua tiếp
0,3,0,0,0,0,3,0,mình đánh_giá cao sự trách_nhiệm của shop đồ mình nhận được cũng rất nhanh cảm_ơn các bạn thật nhiều
3,0,3,0,0,0,0,0,hàng đẹp vải đẹp
3,0,3,0,0,0,0,0,đẹp xuất_sắc luôn chúc shop buôn may bán đắt nhé chất_lượng sản_phẩm tốt và đáng tiền vừa thông_báo giao hôm trước thì ngay hôm sau đã có đồ giống như trong miêu_tả sản_phẩm
0,0,3,0,0,0,0,0,vải chất_liệu rất ok
0,0,1,0,0,0,0,0,chất_liệu kém có_thể trả lại không
0,0,0,2,0,0,0,0,chán không biết nói sao luôn
0,0,0,0,0,3,0,0,quá tiện_lợi giá lại rẻ
0,0,0,2,0,0,0,0,chất vải không giống mô_tả không phải thun lạnh 4 chiều thường để may đồ bơi mà là thun bình_thường rất dễ bị xước
0,0,0,0,0,0,0,1,quảng_cáo 30cm giáo cái 24cm phải sang_tên cho người khác
1,0,0,0,0,2,0,1,không đẹp như hình nhưng chất_liệu ổn so với giá có 1 vấn_đề mình nghĩ size không chuẩn size 36 nhưng nhỏ tầm 3234 thôi
3,0,0,0,0,3,0,0,quần đẹp chất_lượng rất ổn giá rẻ
0,3,3,0,0,3,0,0,quần xịn nha nên mua giá tốt giao cũng nhanh
0,0,0,0,0,0,0,3,rất hài_lòng sản_phẩm y hình nhận được hàng rất là ưng áo ôm vừa khít với ngực nha mặc_dù ngực mình khá nhỏ sẽ tiếp_tục ủng_hộ shop
0,0,0,0,0,0,1,0,mua size xxl nhưng lại giao xl nếu không có áo thì phải báo lại chứ mặc sao vừa hả shop
3,0,0,0,0,0,2,0,vải đẹp nhưng áo của mình không có đường viền dài từ nách áo đến cổ_tay như ảnh
1,0,0,0,0,0,0,0,form xấu mặc không vừa_ý
0,3,0,0,0,0,3,0,shop giao hàng đầy_đủ che tên sản_phẩm nữa có tâm
3,0,0,0,0,0,0,0,quần đẹp may chắc_chắn đáng mua
0,0,0,2,0,0,0,0,tuy không giống như mong_đợi nhưng tôi rất thích
3,0,3,0,0,0,0,3,1m7 nặng 70kg mặc 3xl ôm đẹp may_mắn là vừa bộ đồ chất_lượng cao thun 4 chiều max chất mềm mịn và co_giãn màu như hình_họa tiết chữ sắc nét một sản_phẩm đáng đồng_tiền bát gạo sẽ ủng
3,0,0,0,0,0,0,0,quần_y mẫu xinh lắm mọi người ạ mình muốn mua thêm
0,0,0,0,0,0,1,0,có cái rách lủng kiểm_tra chưa kĩ đã đóng giao
0,0,0,2,0,0,0,0,sản_phẩm có chất_lượng tương_đương với giá
3,0,3,0,0,0,0,0,quần đẹp chất vải ưng giá phù_hợp rất đáng mua nha mọi người
0,0,0,0,0,0,0,3,áo rất đẹp hài_lòng mình 1m66 nặng 65kg chọn size l unisex thấy vừa đẹp
0,0,0,0,0,0,0,3,nâng ngực tốt ôm nhẹ tạo khe ok quá tiện khi mặc các loại váy
3,3,0,0,0,0,0,0,quần đẹp lắm ạ giao hàng cũng nhanh sẽ ủng_hộ shop tiếp nè
3,0,0,0,0,0,0,0,vải đẹp good
0,0,3,0,0,0,0,0,vải tốt co_dãn tốt
0,3,0,0,0,0,0,0,giao hàng nhanh hàng như mẫu đẹp
3,0,0,0,0,0,0,0,hàng đẹp mình mua được giá sale nên càng ưng_ý nên mua nhé
0,0,0,0,0,0,0,3,thích bộ này size chuẩn như miêu_tả muốn mua thêm 1 bộ cho chị_gái mà chưa có size xl sẽ quay lại sau thanks
3,0,0,0,0,0,0,0,áo cực_kì đẹp chất ren mềm cao_cấp nhưng buồn là mình đo theo số_đo của bảng chỉ_dẫn đặt size của hãng thì mình mặc bị chật quá vì chưa mua của hãng bao_giờ nên sợ form áo to nên không dám đặt size như
1,0,0,0,0,0,0,0,mau sắc nhạt so vơi mau quang cao
0,3,3,0,0,0,0,0,sản_phẩm ok có giảm_giá nên giá tốt quần chất vải mát mặc không thay đường viền của quan giao hàng nhanh
3,0,0,0,0,0,0,0,vải ok đẹp như hình
0,0,0,2,0,0,0,0,hài_lòng y hình nên mọi người cứ yên_tâm đặt_hàng nhé
0,0,3,0,0,0,0,0,mua mấy lần rồi mà lần nào cũng ưng_ý hết ạ chất vải đẹp thật_sự nói_chung là tuyệt_vời nhé
3,0,0,0,0,0,0,3,đồ đẹp size đúng tui á
0,0,0,2,0,0,0,0,hài_lòng sẽ mua tiếp
3,0,3,0,0,0,0,0,mình chọn giao hàng tiết_kiệm nên hơi lâu xíu sản_phẩm khá đẹp vải có vẻ mát sẽ ủng_hộ shop lần sau
3,0,0,0,0,0,0,0,áo đẹp nhung minh mặc giống ma dai quá shop co loại ngắn và nhỏ hơn kg cho minh đổi đi shop
1,0,0,0,0,0,0,1,quần mua quá nhiều rồi xài ok nhưng khẩu_trang thì không ổn nhỏ và màu không trắng xấu
0,0,0,0,0,0,1,0,mua áo ngực mà giao vớ chẳng thà nói hết hàng sao lại giao vớ rồi vẫn lấy 124k chồng mình nhận không biết nên trả tiền haiz
3,3,0,0,0,0,0,1,áo hơi dài nhưng giáo hàng nhanh đẹp
0,0,0,2,0,0,0,0,size xl nhưng không chuẩn tôi 60kg nhưng mặc không vừa chất_liệu không nhiều cotton như loại kate sill thường có áo dạng body nên trung_niên có tuổi với vòng 1 2 hơi to sẽ không sử_dụng được tôi muốn hoàn_trả
0,0,0,2,0,0,0,0,mình mua cùng với áo nam màu trắng mua thành cặp để tặng rất ưng luôn
0,0,0,2,0,0,0,0,mình cảm_thấy sản_phẩm không như mong_đợi không ưng
3,3,0,0,0,0,0,0,quần đẹp giao hàng đúng hẹn
3,0,0,0,0,0,0,0,quần đẹp 4 cái lấy 4 màu
3,0,3,0,0,0,0,0,dù đôi chỗ còn may chưa đẹp lắm nhưng được cái vải rất đẹp hình in đẹp rất hợp với áo nên cũng hài_lòng mua cái này là cái thứ 3 rồi shop
0,0,3,0,0,0,0,0,vải đẹp
3,0,0,0,0,0,0,0,áo bao đẹp lên dáng bao xinh nhé mọi người nên mua sẽ tiếp_tục ủng_hộ shop nha
3,0,0,0,0,0,0,0,xinh
0,0,3,0,0,0,0,0,chất vải tốt
0,0,0,0,3,0,0,0,đóng_gói đẹp có_thể làm_quà tặng cho mẹ
3,0,0,0,0,3,0,0,mua lúc sale nên giá rẻ biết đẹp mua mấy cái rồi
0,0,0,0,0,0,0,1,size hơi nhỏ vải ok
0,0,0,0,0,3,0,0,sản_phẩm tốt giá hợp_lý
3,0,3,0,0,0,0,0,hàng rất đẹp mặc êm thoải_mái
3,0,3,0,0,0,0,0,áo giống hình_mẫu đẹp chất mịn có 2 cặp dây trong và dây đen áo có nâng có chống tuột nhưng chỉ ở tầm trung thôi cảm_giác áo hơi rộng vì áo bình_thường mình mặc size 3885 mút mỏng mà còn thấy chật đằng
0,0,0,2,0,0,0,0,xuất_sắc
3,0,3,0,0,0,0,0,vải tốt kiểu đẹp
0,0,0,2,0,0,0,0,đặt 2 cái size l mà cửa_hàng giao 1 cái size l 1 cái size xxl
3,3,0,0,3,0,0,0,vải đẹp đóng_gói kỹ giao nhanh rất hài_lòng
3,0,0,0,0,0,0,0,đồ xinh lắm nhé shop mỗi tội mình hơi bị chật cái tay nhưng mà không sao mặc ổn lắm nè
3,0,0,0,0,0,0,3,chất_liệu bền đẹp size vừa và đẹp như hình tiki bán hàng uy_tín
3,0,0,0,0,0,0,0,sản_phẩm đẹp cho shop 5 sao
0,0,1,0,0,0,0,0,áo thô nhám không như hình
0,0,1,0,0,0,0,3,áo mặc khá thoải_mái nhưng vải hơi nóng mình nghĩ phù_hợp với giá tiền nên mua ạ
3,3,0,0,0,0,0,0,sản_phẩm tốt tiki giao hàng nhanh mẫu random nhưng đều đẹp
3,0,0,0,0,0,0,1,ren đẹp giá_cả hợp_lý sau khi đã giảm và được trừ voucher các kiểu 167k 5quần size quần hơi nhỏ hơn size bình_thường vòng 3 mình 92 chọn size l vẫn chật bình_thường các nhãn hàng khác mình chỉ mặc
1,1,0,0,0,0,0,0,ảnh cúc đen giao cúc sắt trắng form áo không được đều mặc dọc 2 bên cúc bị tòe ra dần từ cổ áo xuống dưới
3,0,0,0,0,0,0,0,sản_phẩm rất đẹp
0,0,3,0,0,0,0,3,mặc thoải_mái chất vải ok lắm có màu đỏ màu hồng giặt riêng nhé m sơ xuất bị loan màu rồi
0,0,0,2,0,0,0,0,quần ok lắm nhé nên mua nha mọi người hình_ảnh mang tính_chất nhận xu
3,3,0,0,0,0,0,0,ôi vải đẹp lắm luôn mọi người không nghĩ giá này áo đẹp v luôn còn giao nhanh nữa
3,0,0,0,0,0,0,0,hàng đẹp như hình đường may đẹp chắc_chắn
0,3,0,0,0,0,0,0,chất_lượng tốt miếng dán chắc_chắn giao hàng cực nhanh
3,0,0,0,0,0,0,3,áo và quần vải màu đẹp mặc vừa_vặn
3,0,0,0,0,0,0,0,áo rất đẹp cảm_ơn shop
0,0,0,0,0,0,0,1,rất thất_vọng vì quần không co_giãn tốt mặc rất khó_chịu mình quên cho 4 sao
0,0,0,2,0,0,0,0,mặc cho vui thì ok
0,0,0,0,0,0,0,1,đồ mặc không vừa cho đổi size shop nhé size xl cao 158 nặng 52kg màu xanh không có màu hồng nha
0,0,1,0,0,0,0,0,khá mỏng
1,0,0,0,0,0,0,0,hàng cũ mềm như đã bị phơi mưa_nắng qua bao năm màu gì già_nua không_thể tưởng_tượng nổi sao lại có nhiều đánh_giá tốt trên tiki như vậy yêu_cầu shop nhanh_chóng đổi hàng cho mình
3,0,3,0,0,0,0,0,áo mặc cũng đẹp êm đặt 2 mẫu 2 giá tiền mà giờ có 1 mẫu shop xem_lại nha
0,0,3,0,0,0,3,0,đã mua bộ đồ bơi này màu xanh chất_liệu tốt cân nặng đúng miêu_tả của shop kiểu_dáng đẹp trẻ_trung với thiết_kế croptop chất vải thun lạnh bền co_giãn đường may đẹp_họa tiết tinh_tế
0,0,0,2,0,0,0,0,chất như nước_cất
0,0,0,0,0,0,0,1,quần chật áo thì rộng mình muốn đổi hàng
3,0,0,0,0,0,0,0,đường may đều dáng quần đẹp
0,0,3,0,0,0,0,0,quần chất đẹp ủng_hộ shop tiếp
0,0,0,0,0,0,1,0,bình_thường shop khác có túi đựng áo của triump shop này không có
3,0,0,0,0,0,0,2,vải đẹp nhưng form khá rộng
0,0,0,0,0,0,0,3,sản_phẩm_chất_lượng mặc vào vừa luôn ưng_ý ghê
3,3,0,0,0,3,0,0,ok good giá hạt_dẻ giao hàng nhanh đẹp thanks tiki nha
1,0,0,0,0,0,0,0,hàng đúng mẫu nhưng có dính vết rỉ sét lâu ngày mình đã phản_hồi với shop nhưng vẫn chưa có hỗ_trợ
3,0,0,0,0,0,0,0,đồ rất đẹp nên mua nhé mọi người
3,0,0,0,0,0,0,0,sản_phẩm rất đẹp màu_sắc đa_dạng đường chỉ rất kỹ_càng rất ưng_ý
0,0,0,2,0,0,0,0,hài_lòng vô_cùng giao hàng nhanh
0,3,0,0,3,0,0,0,sản_phẩm_chất_lượng chất vải su y_như mô_tả mình mua của thời_trang liên_minh đóng_gói và giao hàng nhanh như cơn gió hi
1,0,1,0,0,0,0,0,quần xấu vải mỏng mà thôi mặc chắc khó_chịu và nóng
0,0,0,2,0,0,0,0,vừa_ý
0,3,0,0,0,3,0,0,giá rẻ so với chất_lượng giao hàng nhanh
0,0,3,0,0,0,0,1,hơi rộng nhưng chất vải ok
0,0,3,0,0,0,0,0,sản_phẩm mặc thoải_mái nhưng không bền mặc tầm 12 tháng là keo bị xúc
0,0,2,0,0,0,0,0,thoải_mái nhưng trời nóng quá thì không thoát mồ_hôi được
3,0,0,0,0,3,0,0,may đẹp trông chắc_chắn shop bán khá là rẻ sẽ mua ủng_hộ tiếp
3,0,3,0,0,0,0,0,màu quần tạm được quần ren thì đẹp chất_lượng khá hài_lòng mặc mát đóng_gói sản_phẩm khá hài_lòng
0,0,0,0,0,3,0,3,vải y hình mặc vừa xinh giá lại tư_chất_lượng
0,0,3,0,0,0,0,0,mặc mát vải nhẹ
0,3,0,0,0,0,0,0,sản_phẩm y hình giao hàng nhanh rất hài_lòng
0,0,3,0,0,0,0,0,quần mát nhẹ nên mua nhỏ lại 1 size so với thông_thường không thích kiểu may đũng như này lắm
3,0,0,0,0,3,0,0,giá rẻ quần đẹp
0,0,0,2,0,0,0,0,shipper nhiệt_tình hàng của may10 là mình yên_tâm rồi
0,0,1,0,0,0,0,0,tạm ổn vải hơi xù dùng tạm
2,0,0,0,0,0,0,0,xài tạm hình_thức không có gì đáng nói
1,0,0,0,0,0,0,0,shop đổi lại giúp mình cái áo khác nhé chứ bị như thế này thì mặc lên xấu lắm nhìn lộ vết cắt không may hết vào nên hơi mất thẩm_mỹ
1,3,0,0,0,0,0,0,giao hàng không giống hình
3,0,3,0,0,0,0,0,áo mặc mát giặt ra màu rất nhẹ chấp_nhận được sẽ ủng_hộ shop thêm màu trắng_đen và vàng
0,0,3,0,0,0,0,1,chất lanh lụa nhẹ mát áo hơi rộng còn quần cạp hơi chật
0,0,0,0,0,3,0,0,đây là đơn thứ 2 mình mua quần_lót này đơn đầu_tiên hàng rất ok mình mới mua thêm lần 2 nhưng quần khác hẳn so với đợt trước phần lót đáy quần vải cực_kì xấu may theo kiểu_dáng đại_trà giá rẻ hơn
3,0,3,0,0,0,0,0,chất_liệu tốt kiểu đẹp
0,0,0,0,0,0,0,1,tôi có_thể đổi hàng được không shop tôi lấy size l và muốn đổi xl vì nó chật quá
3,3,0,0,0,0,0,0,áo khá ổn đẹp hơi mỏng nhưng không có chỉ thừa giao nhanh rất đáng mua nha mọi người
1,0,1,0,0,0,0,0,vải không được đẹp mỏng
0,3,0,0,0,3,0,0,tuyệt_vời về mẫu_mã chất_lượng giá_cả giao hàng nhanh
3,0,0,0,3,0,0,0,đường may ở cổ áo đẹp không bị lệch hay dồn cục bao_bì đẹp đóng_gói kỹ_càng mình thích mặc áo vải cotton 100 vì thấm hút mồ_hôi cực tốt mà nhanh khô nữa giờ hiếm shop nào làm có tâm như shop goking
0,3,0,0,0,0,3,0,hàng quá_ư là ok so với tầm giá giá thường_ngày mình mua toàn 3k giao hàng khá nhanh dịch_vụ khách_hàng của shop tốt dù mình không có yêu_cầu hay thắc_mắc gì nhưng shop thường_xuyên cập_nhật tình_hình
0,3,0,0,3,0,0,0,giao hàng nhanh đóng_gói chắc_chắn sẽ ủng_hộ shop
3,0,0,0,0,0,0,0,sản_phẩm đường may chắc chắc chất_liệu vải đẹp
0,0,0,2,0,0,0,0,đây là hàng tàu mà nói việt_nam
2,0,3,0,0,0,0,0,hàng chuẩn giống hình mặc thoải_mái
0,0,3,0,0,0,0,3,vải dày_dặn form vừa chất_lượng 5 sao tiếp_tục ủng_hộ shop
0,0,0,2,0,0,0,0,chất_lượng tuyệt_vời shop ơi
3,3,3,0,3,0,0,0,chất đẹp giao hàng nhanh đóng_gói cẩn_thận
0,0,3,0,0,0,0,0,loại vải này mềm êm như hình hút mồ_hôi tốt rất ưng_ý bạn này sành_điệu không nên mua kiểu truyền_thống
0,3,0,0,0,0,0,0,giáo hàng nhanh
0,0,0,0,0,0,0,1,size hơi nhỏ chất thun cũng ok
0,0,3,0,0,0,0,0,quần chất đẹp lắm luôn đang mua tiếp sản_phẩm tiếp sẽ shop dài_dài
0,0,3,0,0,0,0,0,vải quần rất co_giãn mát mịn góp_ý chút nè shop làm ống_quần nhỏ hơn 1 chút là tuyệt_vời luôn đó
3,0,3,0,0,0,0,3,chất_liệu vải ok đẹp như hình mặc rất thoải_mái
0,0,2,0,0,0,0,0,giá gần 180k chất_liệu áo tạm ổn thôi so với giá_thành gọi là tạm được
0,0,0,2,0,0,0,0,hài_lòng rất chi là hài_lòng
0,3,0,0,3,0,0,0,rất ok móc chắc_chắn giao hàng nhanh shop đóng_gói kỹ
0,0,0,2,0,0,0,0,không hài long tôi đặc size 65kg mà giao cho tôi size 50kg
0,0,0,2,0,0,0,0,chưa được 1 phút đã bong mẹ ra rồi tốn tiền
3,3,0,0,3,0,0,0,mẫu đẹp đóng_gói cẩn_thận giao hàng siêu nhanh thanks shop và shipper
0,0,2,0,0,0,0,0,chất cũng ok nhưng hơi mỏng
2,0,1,0,0,0,0,0,form thì đẹp nhưng chất_liệu thì kinh_khủng mùi vải rẻ_tiền chất_lượng kém giặt mấy lần cũng không hết sợ quá đành phải bỏ đi mà áo nhìn ngoài màu cháo_lòng bẩn bẩn chứ không trắng_tinh như trong ảnh híc
3,0,3,0,0,0,0,0,áo đẹp nha ren mịn
0,0,3,0,0,0,0,0,hàng co_giãn mịn
3,0,3,0,0,0,0,0,áo bị rách túi mỏng thô lắm
3,0,3,0,0,0,0,0,với giá 25k quần thì may cẩn_thận và vải như này ok
0,0,0,0,0,0,0,3,nâng ngực tốt ôm trọn tạo khe dính cực nha
0,3,0,0,0,0,0,0,giao hàng nhanh
3,0,3,0,0,3,0,0,giá rẻ vải tốt đường may đẹp
0,0,0,2,0,0,0,0,hàng ok
0,3,0,0,0,0,0,0,sản_phẩm rất ok so với giá tiền rất hài_lòng về shop ạ nhận được hàng nhanh lắm ạ
0,0,0,0,1,0,0,0,hàng gói không có giỏ bao_bì
0,0,0,0,3,0,0,0,sản_phẩm tốt gói hàng ok
3,0,0,0,0,0,0,3,áo đẹp size chuẩn vừa_ý
0,0,3,0,0,0,0,0,rất ưng_ý với combo này luôn vải siêu mát mặc giống không mặc luôn í nên mua nha mọi người
0,0,3,0,0,0,0,0,tạm hài_lòng vải dày_dặn màu cũng hài_hoà tuy_nhiên phần bao bàn_tay hơi ngắn không thoải_mái khi dùng bao bàn_tay
3,0,0,0,0,0,0,0,bạn nào muốn mua thì mua nhanh đi nha đẹp xỉu luôn áo ôm vừa người siêu tôn dáng giá_thành lại rẻ nữa bận rất thoải_mái vải mềm_mại và mịn áo đẹp nặng_tay vải mát lạnh ok lắm phần thân
0,0,1,0,0,0,0,1,quần ngắn và nhỏ vải mỏng
0,0,0,2,0,0,0,0,hàng như giới_thiệu
0,0,0,2,0,0,0,0,hợp giá tiền
0,3,0,0,0,0,3,0,shop nhiệt_tình với khách_hàng lắm trả_lời tư_vấn bất_kể thời_gian ship hàng siêu nhanh luôn ạ
0,3,0,0,3,0,3,0,sản_phẩm đóng_gói cẩn_thận giao hàng nhanh nhiệt_tình sẽ quay lại ủng_hộ shop nếu có nhu_cầu
3,0,3,0,0,0,0,0,rất hài_lòng về chất_lượng cũng như giá_cả mình 65kg mặc vừa y thoải_mái và đẹp
0,0,2,0,0,0,0,0,tạm ổn chất_liệu vải chưa được như_ý lắm cần thời_gian để xem chất_lượng sản_phẩm
0,0,3,0,0,0,0,0,vải tốt mát mịn mặc co_giãn thoải_mái lắm ạ
0,0,0,2,0,0,0,0,áo không tuột cúp mềm dáng tự_nhiên
3,0,0,0,0,0,0,0,đẹp nha_shop
0,0,0,2,0,0,0,0,dùng được
0,0,1,0,0,0,0,0,vừa mặc đã đứt chỉ phía trước và sau vải thun giãn và mỏng lần đầu đặt_hàng quần_lót trên mạng do đã xem đánh_giá tốt chưa bao_giờ mua phải hàng tệ không bằng quần xài 1 lần chỉ nên mua trên mạng
3,0,0,0,0,0,0,3,vải đẹp vừa_vặn
3,0,0,0,0,0,3,0,sản_phẩm đẹp thực_tế trông như hình gặp chút vấn_đề trong việc chọn size và được shop hỗ_trợ tư_vấn vô_cùng vô_cùng nhiệt_tình recommend cao cho sự nhiệt_tình và chất_lượng của sản_phẩm
