appearance,delivery,fabric_quality,others,packaging,price,service,size_fit,processed_text
0,0,0,0,0,0,0,1,áo nhỏ hơn so với mô_tả
3,0,0,0,0,0,0,0,áo đẹp như mẫu luôn nha mọi người
0,3,0,2,0,0,0,0,rất hài_lòng sản_phẩm tốt shop giao đúng mẫu nhanh
0,0,0,0,0,0,0,3,nâng ngực ôm gọn bầu ngực mặc ok lắm
3,0,3,0,0,0,0,0,quần đẹp vải mát cho kiểm hàng kĩ rất hài_lòng với tiki mua hàng gì cũng được kiểm_tra
3,3,3,0,0,0,0,0,shop giao hàng nhanh đúng mẫu_mã váy dáng khá ok vải không bị lộ chất vải đũi thô mặc mát váy lên dáng đẹp mình 1m6 50 kg mặc lên ok nhé nên mua
0,3,3,0,0,0,0,3,chất_liệu vải dày vừa_vặn máy khéo giao hàng sớm
0,0,3,0,0,0,0,0,chất_liệu mặc mát đúng như hình
0,0,3,0,0,0,0,0,vải mềm co_giản mát nếu thích thoải_mái thì chọn theo size của shop
1,0,1,0,0,0,0,0,hàng xấu quá đường may bị lỗi rất nhiều
0,3,0,0,0,3,0,0,hàng chuẩn rẻ giao hàng nhanh đáng cho 5 sao
3,0,0,0,0,0,0,0,nói_chung tốt may khá đẹp mặc đi chụp hình với áo_dài đẹp
3,3,0,0,3,0,0,3,xinh như hình ạ size chuẩn chất_lượng tốt tiki đóng_gói đẹp và giao hàng nhanh thanks nhiều
3,0,0,0,0,0,0,0,đường chỉ may kín không bị nhoè hình in vải chất_lượng
0,0,2,0,0,0,0,1,size quần không đúng so với cân nặng độ co_giãn cũng không được thoải_mái như mô_tả mình 55kg 160cm mà mặc xl vẫn cảm_giác bị bó chất_liệu form thì ok
1,0,0,0,0,0,0,0,áo đúng mẫu nhưng hơi bị bẩn
0,0,0,2,0,0,0,0,ok
3,0,3,0,0,0,0,0,hàng đẹp như hình nhưng không có bông giống hình nên cũng buồn chút mà ok thoải_mái
0,0,1,0,0,0,0,0,vải nóng xừ long hàng không ok
0,0,0,2,0,0,0,0,cảm_thấy bị dối vì hàng giao không đủ
0,0,1,0,0,0,0,0,vải mỏng quá chất_liệu không như mong_đợi
3,0,0,0,0,0,0,0,so với giá thì chất vải đẹp ngỡ_ngàng hình_họa tiết dạng chỉ thêu rất đẹp chứ không phải in quá ổn 5 sao và theo_dõi shop luôn sau khi khui hộp
1,0,0,0,0,0,0,0,áo xấu ngắn không hài_lòng
3,0,3,0,0,0,0,0,thoải_mái đẹp
0,0,0,2,0,0,0,0,dùng tạm ổn nhưng hơi bí khi vận_động mồ_hôi ra
0,0,3,0,0,0,0,2,chất đẹp có điều ông hơi rộng so với chân mình ý_kiến cá_nhân mình thôi nha lưng thun co_giãn nên mình mặc size nào cũng được
0,3,0,0,0,0,0,0,giao hàng nhanh như 1 cơn gió trưa đặt chiều giao rồi hàng chất_lượng nha nên mua ạ
0,0,3,0,0,3,0,0,quần co_giãn thoáng mát mua được giá rẻ
3,0,3,0,0,0,0,0,hàng đẹp mát
3,0,3,0,0,0,0,0,rất đẹp vải mặc rất mát
0,0,0,2,0,0,0,0,mình đặt_hàng từ 212 đến giờ vẫn chưa nhận được
0,0,0,2,0,0,0,0,sản_phẩm đúng mô_tả
2,0,0,0,0,0,0,0,chất lương tốt y hình shop tâm_lý giá hợp_lý nhé mọi người ơi
3,0,3,0,0,0,0,3,sản_phẩm đẹp vải tốt đã mua 2 lần rồi mặc vừa in luôn ạ đẹp lắm ạ
0,0,3,0,0,0,0,0,áo mềm dùng thích lắm luôn á
0,0,3,0,0,0,0,0,vải đẹp mát
0,0,3,0,0,0,0,0,quần thoáng mát vải xịn
3,0,3,0,0,0,0,0,kiểu_dáng đẹp thoáng mát
0,0,1,0,0,0,0,0,áo hơi mỏng
3,0,3,0,0,0,0,0,vải tốt co_giãn mềm đường may chỉnh chu nhưng chỉ thừa chưa cắt với mức giá khi giảm_giá thì xứng_đáng được 5 sao
0,0,3,0,0,0,0,0,áo rất mềm êm đúc không gọng mặc thích lắm
0,0,0,2,0,0,0,0,tôi rất hài_lòng
0,0,1,0,0,0,0,0,vải thô không mềm_mại như tưởng_tượng
0,0,0,2,0,0,0,0,cho em hỏi em đặt màu trắng sao shop lại chuyển cho em màu nâu tây ạ
0,0,0,2,0,0,0,0,quá ok
0,0,3,0,0,0,0,0,chất rất ok
0,0,3,0,0,2,0,0,đồ thun mát hợp với giá_cả
0,3,0,0,0,3,0,0,sản_phẩm tốt lắm giá cạnh_tranh shop ship nhanh ủng_hộ shop nè
0,0,0,2,0,0,0,0,sản_phẩm cũng ok
3,0,0,0,0,0,0,0,vải đẹp may cẩn_thận nên mua
0,0,3,0,0,3,0,3,ôi chất vải thích quá quần mặc ôm vừa người phải mua thêm á mọi người ơi giá_cả không đắt mua không phải lăn_tăn gì cả
3,0,3,0,0,3,0,0,đầm đẹp ạ mặc thoải_mái giá rất ok đáng tiền lắm ạ cảm_ơn shop
0,0,3,0,0,0,0,0,quần thấm hút mồ_hôi tốt lắm
3,0,0,0,0,0,0,0,thun đẹp may đẹp rất hài_lòng
0,0,0,2,0,0,0,0,cũng tốt
0,0,0,2,0,0,0,0,quần ok
3,0,3,0,0,0,0,0,chất_lượng ok from vừa_vặn đường may tỉ_mỉ các bạn nào có số kg hơi quá_cỡ tí lựa được nè nói_chung khá hài_lòng nên mua shop này
3,0,0,0,0,3,0,1,quần đẹp giá quá rẻ tuy_nhiên size l mặc không được thoải_mái lắm nếu có thêm size lớn nữa thì sẽ ủng_hộ tiếp
0,0,0,2,0,0,0,0,cho 5 sao
3,0,0,0,0,0,0,3,mặc đẹp size không được đều nhưng mình mặc vừa không vấn_đề thoải_mái
0,0,0,2,0,0,0,0,chất_lượng cũng tạm tạm bị sứt chỉ khi giặt máy
0,0,0,2,0,0,0,0,sản_phẩm rất tốt
0,0,3,0,0,0,0,0,chất khá tốt
3,0,0,0,0,0,0,0,áo đẹp lắm nha nhưng vải dễ bị xù lông với lại nón nhỏ quá
3,0,3,0,0,0,0,0,cảm_ơn shop áo rất đẹp vải dày nhưng mặc vào rất mát đường chỉ may đẹp áo có 6 túi mỗi bên trong áo có 2 túi đều có dây kéo rất tiện cảm_ơn thấy rất hài_lòng sẽ tiếp_tục ủng_hộ shop
0,0,0,2,0,0,0,0,mình đặt 3 sản_phẩm thì giao 2 sản_phẩm nhưng shop có nhắn lại là sẽ báo hoàn lại tiền nhưng lại không địa_chỉ cụ_thể của shop đặt 1 cái quần_dài và 1 cái quần lửng thì lại giao 2 cái quần lửng hơi
0,0,1,0,0,0,0,1,không vừa_vặn thiết_kế cúp ngực làm xấu form áo mặc ngoài đai dày mặc nóng
3,0,0,0,0,0,0,0,mình rất ít khi đánh_giá sản_phẩm nhưng phải nói hàng rất đẹp
0,0,0,0,3,0,0,0,sản_phẩm như mô_tả đóng_gói cẩn_thận hài_lòng
3,0,3,0,0,0,0,0,đẹp và thoáng mát thỏa_mái chất_lượng vải tốt cho 5
3,0,3,0,0,0,3,0,mình hài_lòng ở shop điều đầu_tiên là hỗ_trợ khách_hàng khá chuyên_nghiệp tiếp đến là chất vải khá đẹp và cuối_cùng là giá_thành vừa phải mình mua ở tiki nhiều nhưng chỉ có duy_nhất shop này là mình
3,0,3,0,0,0,0,0,mỏng nhẹ co_giãn tốt màu_sắc tươi_sáng dùng rất thích
3,0,0,0,0,0,0,0,sản_phẩm rất đẹp và chất_lượng may chắc_chắn
0,1,0,0,0,0,0,0,giao hàng lâu ơi là lâu nhưng dịch nên thông_cảm cho shop mua dùm chưa thấy khách_hàng phản_hồi xấu đẹp thế_nào chỉ mong dịch_bệnh qua nhanh để mọi người được an_tâm ra đường
3,0,0,0,0,0,0,1,hàng chất mềm mỗi tội size hơi bé so với thực_tế
0,0,3,0,0,3,0,0,áo từng mua nên vẫn rất ưng mặc_dù độ nâng rất nhẹ chất_liệu vải rất mềm_mại thoải_mái mặc vào không xô lệch nên rất tự_tin và không cần chỉnh_sửa gì giá_cả cũng hợp_lý nha
0,0,0,0,0,3,0,0,giá tốt
0,0,0,0,0,0,0,3,quần mặc thoải_mái
3,0,0,0,0,0,0,0,chất_lượng tốt hàng đẹp
0,0,0,2,0,0,0,0,hàng tạm ổn
0,0,0,0,0,3,0,0,chất_lượng tốt nhé mọi người giá_cả hợp_lý quần không mỏng đâu lúc đầu mọi người nói mỏng nên mình hơi lăn_tăn nhưng nhận hàng xong ưng_ý hết_sức ai mà eo 68 trở xuống chọn size s sẽ vừa hơn
3,0,0,0,0,0,0,0,áo siêu đẹp có diệp lần sau sẽ mua lại
0,0,0,0,0,0,0,3,ôm người size đúng với mô_tả nên vừa in luôn cảm_giác mặc rất thoải_mái quần chất_lượng 5
0,0,0,2,0,0,0,0,đồ ok lắm shop
0,0,3,0,0,0,0,0,viền không bị hằn lên da mặc thoải_mái ship nhiệt_tình
3,0,0,0,0,0,0,0,hàng đẹp thích lắm
3,0,0,0,0,0,0,0,đồ đẹp lắm ạ nên mua đồ ở shop này nha mọi người
0,0,1,0,0,0,0,0,chất_liệu không tốt lắm thấy hơi cứng
1,0,1,0,0,0,0,0,màu đậm quá_tay_áo có chun bó và ngứa không đẹp không hợp 1 sao
3,0,0,0,0,0,0,0,rất đẹp thun dày mịn đúng size
0,0,0,0,0,0,1,0,đặt quần lửng shop giao quần dài vải dày và cứng
3,0,3,0,0,0,0,0,vải êm màu đẹp
0,0,0,0,0,2,0,0,ok theo giá
0,0,3,0,0,0,0,0,hàng việt nam chất_lượng cao cảm_ơn shop chất vải đẹp theo mình tìm_hiểu thì sản_phẩm của goking hoàn_toàn nguyên_liệu từ cotton mặc rất thoáng rất đáng đồng_tiền bỏ ra
0,0,1,0,0,0,0,0,hơi mỏng thấy áo bên trong
0,0,0,2,0,0,0,0,so_sánh với cái mua sản_xuất ở thái lan cùng loại thì gần giống nhau so nhãn trên web chủ của truimp và cái nhãn của shop thì khác nhau vậy sản_phẩm thật không vậy
0,0,3,0,3,0,0,0,đóng_gói rất đẹp chất_lượng ok nâng đẹp không lộ
0,0,0,2,0,0,0,0,ngon
2,0,0,0,0,0,0,0,vai đẹp ma đường may xấu qua
0,0,0,2,0,0,0,0,xem đánh_giá sẵn thì cũng hơi rén nhưng mình thấy sản_phẩm khác nên mạnh_dạn mua kết_quả ngoài sự mong_đợi mọi người ạ loại quần này công_ty mình nhiều người cũng dùng rồi đều ưng quần_lót này còn gọi
0,0,3,0,0,0,0,3,quần_y hình mình 57kg mặc vừa nhé vải mát co_giãn
0,0,3,0,0,0,0,0,chất tưởng dày mà không dày mát co_dãn ok la sẽ mua thêm
3,0,3,0,0,0,0,0,vải mát form đẹp
0,2,0,0,0,0,0,1,mua xong không mặc được vì chất quá xấu
0,0,3,0,0,0,0,0,chất_liệu ok ạ
0,0,0,0,3,0,0,0,vì có mã giảm_giá nên mua luôn xài sao thì chưa biết vì mới nhận nhưng nhận hàng thấy mẫu_mã ổn và đóng_gói chỉnh chu
0,0,0,2,0,0,0,0,áo ok
0,0,0,2,0,0,0,0,màu thực_tế không vàng tươi như hình
3,0,3,0,0,0,0,0,đẹp chất_liệu tốt
0,0,2,0,0,0,0,0,chất_liệu vải mát nhưng mềm dễ bị lộ khuyết_điểm
0,0,1,0,0,0,0,0,đánh_giá không tính điểm vải quá mỏng không đứng form
0,0,0,2,0,0,0,0,đang tìm hàng chính hãng để so_sánh
3,0,3,0,0,0,0,0,loại áo nâng ngực mình hài_lòng nhất dùng rất nhiều loại giá cao hơn nhiều nhưng không thích bằng đây là loại mút dày cài trước quả áo không quá to hợp với bạn ngực vừa nhé chất vải tốt hoa_văn đẹp
0,0,0,2,0,0,0,0,rất hai long
0,0,0,2,0,0,0,0,sản_phẩm thử thì tạm được
3,0,0,0,0,0,0,0,áo đẹp lắm shop giá rẻ hơn nữa mình sẽ mua nhiều mua thử nhưng chất_lượng khá ok
0,3,0,0,0,0,0,0,hàng khá ok giao nhanh
2,0,0,2,0,0,0,0,rất hài_lòng màu như trong ảnh
0,0,3,0,0,0,0,0,sờ thích tay ổn sẽ mua lại
0,3,0,0,0,0,0,0,mua hàng của shop mấy lần rồi lần nào cũng ưng_ý giao hàng thì siêu nhanh
2,0,0,0,0,0,0,0,tưởng màu xanh ai_ngờ màu nâu và còn bị mất chữ
1,0,0,2,0,0,0,0,cần phải trả tiền màu_sắc sáu
0,0,0,2,0,0,0,0,ok á
0,0,0,2,0,0,0,0,lưng hơi cao không mặc được với loại quần đáy ngắn
0,0,0,0,0,0,0,1,chất mềm có điều lúc mặc phần dây 2 bên bị nhăn nhiều chắc do mình mặc hơi bị chật chút dù có nhờ shop tư_vấn size rồi dù_sao cũng ok hoan_hỉ cho shop 5 sao
0,0,0,2,0,0,0,0,bán hàng xỏ_lá ghi size cho lấy có mua lần nào size gi cũng 1 cỡ
0,0,0,2,0,0,0,0,tôi đặt màu sữa sao lại giao màu trắng
3,0,3,0,0,0,0,0,chất vải đẹp kiểu cổ_điển dễ mặc
0,0,3,0,0,3,0,0,quần giá rẻ vải mát siêu hài_lòng
0,0,3,0,0,0,0,0,do chất_liệu tốt
0,0,0,2,0,0,0,0,tiền nào của nấy sản_phẩm tốt
0,0,0,2,0,0,0,0,rất thích bộ này thanks tiki nha
0,0,3,0,0,0,0,0,tạm được vải ổn co_giãn tốt
0,3,0,0,0,0,0,0,giao hàng nhanh tạm được
0,0,0,2,0,0,0,0,so rất ok
0,0,0,2,0,0,0,0,sản_phẩm không như quảng_cáo
0,0,0,2,0,0,0,0,sản_phẩm tương_đối ok dung thoải_mái lắm ạ
0,3,0,0,0,0,3,0,giao hàng nhanh chất_lượng sản_phẩm ok sóc nhiệt_tình nha được nha nhanh nha
0,0,0,2,0,3,0,0,giá mềm xài rất ok
3,0,0,0,0,0,0,0,đẹp nhưng mua 2 cái mà 1 cái không có nút rồi sao mặc đây shop
0,0,0,0,3,0,0,0,mặc khá ok giao hàng nhanh tuy_nhiên có vết bẩn
0,3,3,0,3,0,0,0,đóng_gói chắc_chắn giao hàng đúng hẹn chất_lượng sản_phẩm ok vải mát mịn mặc tôn vòng 1 đệm mỏng
0,0,0,2,0,0,0,0,cực_kì hài_lòng
0,0,0,2,0,0,0,0,hàng rất ok nha_shop
0,0,3,0,0,0,0,0,quần sờ mềm_mại lắm chưa mặc thử nên không biết vừa không nhưng mà cảm_quan ban_đầu là thích
0,0,0,0,0,0,3,0,sản_phẩm_chất_lượng tốt mình mua shop 2 lần rồi shop tư_vấn rất nhiệt_tình
0,0,1,0,0,0,0,0,quá dày vải rất xấu
0,3,0,0,0,0,0,0,thời_gian giao hàng nhanh sản_phẩm_chất_lượng rất đáng tiền
0,0,3,0,0,0,3,3,ban_đầu shop giao sai hàng shop nhiệt_tình đổi lại thấy yêu ghê quần mặc vừa_vặn chất vải thì đúng ý luôn á mỏng mềm mịn co_dãn mình 1m54 nặng 52kg mông 96 đùi 56 đáng đồng_tiền bát gạo ghê
3,0,3,0,0,3,0,0,vải áo thun giãn mặc dễ_chịu quần có thun thắt_lưng nên vừa chỉ không hiểu sao quần và áo không trùng màu và chất_liệu chắc shop có_lý_do giá rẻ chất_lượng tốt đường may chắc_chắn phù_hợp cho
0,0,0,0,0,0,0,1,áo ngắn mình cao chưa đến 1m50 mà còn bị ngắn đành cho lại con_gái 9 tuổi mặc
0,0,2,0,0,0,0,2,mặc không bị bí với kẹt đâu ạ
0,0,0,2,0,0,0,0,xịn lắm nha nên mua lại
0,0,0,2,0,0,0,0,lấy xu
0,0,0,0,0,3,0,0,khá thích về chất_liệu của áo giá cũng mềm nữa sẽ ủng_hộ cá đợt sau
0,0,0,2,0,0,0,0,không ưng_ý lắm
0,0,0,0,0,0,1,0,đánh_giá giống áo màu trắng buôn_bán mà cứ không đàng_hoàng hoài_vậy
0,0,0,0,0,0,1,0,bán hàng như cái con bán hàng như lợn cho 3 cái cùng một màu hôm_nay lỡ nhờ người lấy hộ chứ còn có ở nhà thì không thèm nhận hàng luôn bán hàng dốt
3,0,0,0,0,0,0,0,chất_liệu ok hàng đẹp giá phải hợp_lý shipper nhiệt_tình
0,0,0,0,0,0,0,1,from rộng chiều dài hơi ngắn
3,3,0,0,3,0,0,0,đường may đẹp chắc_chắn shop đóng_gói kĩ giao hàng nhanh sản_phẩm như hình
0,0,0,2,0,0,0,0,rất hài_lòng mình sẽ ủng_hộ shop
0,3,0,0,0,0,3,0,giao hàng nhanh_chóng shop nhiệt_tình shop cũng rất tâm_lý khi khéo_léo che tên sản_phẩm trên bill gửi hàng mình cũng đỡ ngại khi ship giao đến hihi cảm_ơn shop
0,0,1,0,0,0,0,0,khuyến_cáo mọi người không nên mua chất_liệu vải rất tệ
0,0,1,0,0,0,0,0,không co_giãn chất không mềm
0,0,3,0,0,0,0,3,áo vừa_vặn thoải máu
0,0,0,0,0,0,0,1,size hơi nhỏ mình phải pass lại cho bé em size l mà cỡ bằng s thông_thường mọi người đặt nên trừ_hao vải cũng được đúng với giá tiền
0,0,3,0,0,0,0,0,sản_phẩm mềm mịn quả_thật quần của mileu form dáng đẹp sẽ tiếp_tục ủng_hộ shop
3,0,0,0,0,0,0,0,rực_rỡ sắc_màu luôn nha
0,0,0,2,0,0,0,0,vẫn chất_lượng như áo lần trước đặt tuyệt_vời lắm mọi người ạ
0,0,0,2,0,0,0,0,rất không hài_lòng gửi không đúng size đã đặt đặt size l gửi size m
3,0,3,0,0,0,0,0,đẹp chất_liệu vải dễ_chịu
0,0,0,0,0,0,0,1,sản_phẩm phù_hợp với giá tiền chất_liệu mình không ưng lấy size l rồi vẫn chật mặc không thoải_mái
3,3,0,0,0,0,0,0,hàng bao đẹp đáng tiền đặt_hàng hôm trước hôm sau có liền tiki giao hàng nội_thành hcm nhanh
0,3,3,0,3,0,0,1,giao nhanh đóng_gói cẩn_thận free size dưới 65kg mà mình thấy quần hơi ôm mặc không thoải_mái bằng bộ trắng mình mua cũng form giống vậy_mà shop khác vải thun có vẻ mát thoáng để giặt xem có bị
0,0,0,2,0,0,0,0,mua đồ bơi nhưng shop giao cái giỏ hàng_chợ không quá 50k tiki có chính_sách lựa_chọn đối_tác không chuyên_nghiệp
0,0,0,2,0,0,0,0,good
0,0,3,0,0,0,0,0,chất_liệu cotton mát_mẻ sẽ ủng_hộ shop lần sau
3,0,0,0,0,2,0,0,đẹp giá hợp_lý sẽ quay lại mua thêm
3,0,0,0,0,0,0,0,đẹp xuất_sắc luôn chúc shop buôn may bán đắt nhé
3,0,3,0,0,0,0,3,màu đẹp chất_liệu mình thích lắm và ôm gọn người nữa cảm_ơn shop nhé
0,3,0,0,0,3,0,0,giá rẻ so với chất_lượng giao hàng nhanh giống mô_tả
0,3,3,0,0,0,0,0,chất lương giao hàng nhanh
3,3,0,0,0,0,0,0,quần đẹp giao hàng nhanh_chóng
3,0,0,0,0,0,0,0,váy quá chẹp
0,0,3,0,0,0,0,0,chất_liệu vải mềm mịn thoáng mát rất vừa_ý
0,3,0,0,0,0,3,0,giao hàng siêu nhanh chu_đáo và chất_lượng của sản_phẩm tuyệt_vời mọi người nên mua ủng_hộ shop nhé
3,0,0,0,0,0,0,0,hình không liên_quan nhưng áo đẹp mặc em không đau nha nên mua và sẽ quay lại ủng_hộ shop
0,0,3,0,0,0,0,0,bộ 10 cái màu ngẫu_nhiên và khi nhận được hàng có 5 màu mỗi màu 2 cái chất_liệu co_giãn tốt
1,0,0,0,0,0,0,0,ảnh đẹp còn ship về thấy xấu
0,0,3,0,0,0,3,0,shop giao đủ hàng đủ màu quần chất vải mịn mát chưa thử nên không biết vừa không
0,0,3,0,0,0,0,0,su mềm lắm mọi người nha mua đồ ủng_hộ shop đi nào
3,0,0,0,0,0,0,0,rất đẹp giống hình
3,0,3,0,0,0,0,0,chất co_dãn cực đã cạp cao miễn bàn luôn dấu bụng tuyệt_vời
0,0,3,0,0,0,0,0,chất kaki nhưng không quá cứng và dày co_giản nhẹ quần ống xuống đơn_giản nhẹ nhàn thanh_lịch giặt cũng không bị ra màu nhiều ở lần giặt đầu_tiên chứng_tỏ sẽ bền màu nói_chung tui rất ưng_ý
0,0,0,2,0,0,0,0,sản_phẩm dùng tốt nên sẽ ủng_hộ tiếp
3,0,0,0,0,0,0,0,sản_phẩm giống hình chất đẹp đường may cẩn thân
3,0,3,0,0,0,0,0,cực_kỳ hài_lòng vải cotton đẹp đường may cẩn_thận nói_chung rất ok đáng mua
3,0,3,0,0,0,0,1,đường may kỹ chất_liệu ổn so với giá màu đẹp mình 48kg mua size l hơi rộng
0,0,0,2,0,0,0,0,giao hàng không đúng size tôi đặt size 38b giao size 34 mặc kiểu gì trời
0,0,0,0,0,0,3,2,đúng màu form cũng đẹp lắm nha shop cũng rep tin nhắn nhanh nữa sẽ tiếp_tục ủng_hộ
3,0,0,0,0,0,3,0,đẹp giống hình chủ shop nhiệt_tình cẩn_thận
0,0,0,0,0,0,0,3,rộng_rãi thoải_mái nói_chung là hài_lòng
0,0,0,2,0,0,0,0,quyển rũ mềm_mại
0,0,0,0,0,0,0,3,dùng thích lắm mọi người mình 50kg mặc l thoải_mái
3,0,0,0,0,0,0,0,váy siêu đẹp siêu xinh săn được giá sale giảm đến 45 nên phải hốt luôn
3,0,3,0,0,0,0,0,áo rất đẹp nhé cả nhà vải cotton nên mặc rất mát bạn nào thích có eo thì chọn áo này mình mua cả có eo và form suông của goking luôn
0,3,3,0,3,0,0,0,sản_phẩm tốt giao hàng nhanh đóng_gói cẩn_thận
0,0,0,2,0,0,0,0,sản_phẩm như mẫu
0,0,0,2,0,0,0,0,mẫu_mã như hình quảng_cáo chất_lượng tạm ổn trong tầm giá ok
3,0,0,0,0,0,0,1,mình 53kg mà áo mặc hơi rộng form đẹp phù_hợp giá tiền
0,3,0,0,3,0,3,0,shop nhiệt_tình đóng_gói hàng cẩn_thận giao hàng nhanh chất_lượng sản_phẩm được
0,0,0,2,0,0,0,0,rất hài_lòng hàng đúng như quảng_cáo
3,0,3,0,0,0,0,0,chất thun mịn mát đẹp hàng đẹp hơn mong_đợi hàng giao quá lâu
0,0,3,0,0,0,0,0,sản_phẩm tốt chất_liệu đẹp form chuẩn
3,0,3,0,3,0,0,0,chất đẹp đường may cẩn_thận shop đóng_gói chắc_chắn sẽ mua thêm ạ
0,0,0,2,0,0,0,0,sản_phẩm giống mô_tả co_giãn tốt chưa sử_dụng nên chưa biết chất_lượng
3,0,3,0,0,0,0,0,chất đẹp sản_phẩm như hình
0,0,0,2,0,0,0,0,treo đầu dê bán thịt
3,3,0,0,0,0,0,0,giao hàng nhanh đẹp
0,0,3,0,0,0,0,0,chất vải thích
1,0,0,0,0,0,0,0,tìm mua logo bò áo có nón giao cái logo gì chả biết không có nón luôn được đúng cái màu là giống thôi tìm mẫu đó từ thứ tự cuối_cùng mới qua đây giao cái gì éo hiểu xấu khủng_khiếp
3,0,0,0,0,3,0,0,đẹp rẻ phù_hợp giá tiền
0,3,0,0,0,0,0,0,shop giao đầy_đủ số_lượng hàng đồng_nhất với nhau giá_cả và chất_lượng sản_phẩm phù_hợp giao hàng nhanh mình rất hài_lòng cảm_ơn shop cảm_ơn tiki
0,3,3,0,0,0,0,0,hàng giống như mô_tả vải mềm giao hàng nhanh
0,0,2,0,1,0,0,1,đùa áo cùng 1 size mà cái to cái bé cái mỏng cái dày 2 chất khác nhau hoàn_toàn không phù_hợp với giá tiền 1 chút nào quá thất_vọng đóng_gói thì sơ_sài như
3,0,0,0,0,0,0,2,áo đẹp như hình hơi mỏng nâng ngực ít tam chấp_nhận
3,0,3,0,0,0,0,0,quần đẹp vải mặc mát mặc tôn dáng lắm ạ giá rẽ hơn so với chất_lượng
0,0,3,0,0,3,0,0,chất_liệu vải tốt giá mềm
0,3,0,0,0,0,3,0,đã mua shop này rất nhiều lần rồi lần nào cũng ưng_ý sản_phẩm tốt giao hàng nhanh shop tư_vấn nhiệt_tình cho 10
3,0,3,0,0,0,0,0,từng cái quần đựng trong 1 cái túi đẹp quá_chừng vải mềm mát mà để bảo_vệ môi_trường thì shop đựng trong 1 túi cũng không sao
3,0,0,0,3,0,0,0,sản_phẩm siêu đẹp nên mua ạ đóng_gói chắc_chắn nhé
0,3,0,0,0,0,3,0,đã nhận được hàng giao nhanh hơn dự_kiến shop có che tên sản_phẩm
3,0,0,0,0,2,0,0,hàng đẹp phù_hợp với giá tiền
0,0,3,0,0,0,0,0,chất_liệu vải tốt
0,3,3,0,0,0,0,0,giao hàng nhanh chất_lượng lượng tốt có kèm dây áo
0,3,3,0,0,0,0,0,hàng giao như hình vải ok
0,0,0,0,0,0,0,1,size xl bụng 63cm mà mặc lên bụng khá chật và bị hằn
0,0,1,0,0,0,0,0,mặc áo bị nóng áo màu tím hơi sáng chói
0,0,0,2,0,0,0,0,hàng chuẩn đấy ạ mình mua hàng onl nhiều rồi lần này rất hài_lòng
0,3,3,0,3,0,0,0,chất_lượng sản_phẩm tốt chăm_sóc khách_hàng rất tốt đóng_gói chắc_chắn giao hàng khá nhanh
3,0,3,0,0,0,0,0,quần đẹp chất mát mẫu này shop để có size nhưng mình nhận là freesize
0,0,0,2,0,0,0,0,giao sai mẫu không giống hình
3,0,3,0,0,3,0,0,sản_phẩm được may rất kỹ_lưỡng có đường viền tinh_tế có đính thương_hiệu xinh_xắn ở phần chun trước chất_liệu vải thoáng mát màu_sắc ngẫu_nhiên nhưng rất trang_nhã giá_cả thật là hợp_lý giao hàng
0,0,3,0,0,0,0,0,như hình chất_liệu vải im ái
0,3,0,0,0,0,3,0,giao hàng nhanh hàng đúng mẫu
0,0,3,0,0,0,0,0,cực mát luôn vải mềm mát
0,0,0,2,0,0,0,0,kiểu đẹp mặc hack dáng tiếc là áo màu xanh đỏ bị ra màu nhưng nói_chung ok so với tầm giá lần 1 mua 229k lần sau giảm còn 143k 129k
3,3,0,0,0,0,0,0,sản_phẩm đẹp giao nhanh
0,0,0,2,0,0,0,0,sản_phẩm ok giống hình
0,0,0,2,0,0,0,0,có chút nhầm_lẫn về size theo mình nên mua size lớn hơn thông_tin mô_tả của shop shop đổi trả size uy_tín
0,0,0,2,0,0,0,0,đã nhận hàng rồi shop cho thêm mã giảm_giá 10 để mua thêm áo_khoác thun mỏng nhé
0,0,3,0,0,0,0,3,sản_phẩm tốt form chuẩn_thun bốn chiều co_giãn tốt
3,0,0,0,0,0,0,0,quần đẹp nhé mọi người mặc rất vừa và đẹp mình mua nhiều shop rồi có shop này là mình ưng bụng nhất cho shop 10 sao luôn hihi
3,3,0,0,0,0,0,0,giao hàng nhanh chất_lượng tuyệt vơi mình ưng nhất lô quần chíp thì cũng qua la đẹp có_thể do mình mặc không đẹp cho shop 5 sao
0,0,3,0,0,0,0,0,chất_liệu ok thoáng
3,0,3,0,0,3,0,0,sản_phẩm rất mát nhẹ đẹp rẻ ủng_hộ may10
3,3,0,0,0,0,0,0,giao nhanh áo đẹp chất_lượng nha
1,0,3,0,0,0,0,1,vải áo tốt nhưng quá rộng và lè phè
0,0,0,0,3,0,0,0,đã nhận được hàng nhé shop đóng_gói rất đẹp ạ mình muốn xin thêm mã giảm_giá 10 để mua tiếp
0,0,0,2,0,0,0,0,rất tốt phù_hợp giá tiền
0,0,0,2,0,0,0,0,oke tốt
0,0,3,0,0,0,0,0,mặc rất mát
3,0,0,0,0,0,0,0,hàng rất đẹp
0,0,3,0,0,0,0,0,áo thun chất đẹp và dáng chuẩn màu đúng như trong hình tuyệt_vời
0,3,0,0,0,3,0,0,giao hàng nhanh sản_phẩm tốt giá_cả phù_hợp comment nhận xu giao hàng nhanh sản_phẩm tốt giá_cả phù_hợp comment nhận xu
0,3,3,0,0,0,0,0,chất vải đẹp có lót mút và có gọng ôm ngực giao hàng nhanh
0,0,3,0,0,0,0,0,vải mềm mặc rất thích cực_kỳ hài_lòng
0,0,0,2,0,0,0,2,đai cứng và tốt nhưng mình mua size l bị rộng có_thể đổi lại m không
0,0,0,2,0,0,0,0,áo khá ổn có gọng mình đặt rất nhiều size để thử nhưng form bình_thường mình dùng là 3680 thì_giờ của size chỉ còn 3475b
3,0,3,0,0,0,0,0,vải mềm_mỏng hình in đẹp đã mua 1 set và giờ quay lại mua thêm 1 nữa
3,0,3,0,0,0,0,0,chất_liệu tốt đường may chắc_chắn
0,0,0,0,0,0,0,1,thông_số size không đúng nên tôi không sư dung được nói_chung hàng may_mặc trên tiki còn kém thông_tin và chât lương chưa bao giơ hai long về hàng may_mặc
0,3,0,2,0,0,0,0,tạm ổn giao hàng nhiệt_tình
0,0,3,0,0,0,0,0,áo free size nên mình mặc rộng lắm chất thì cũng ổn_áp lắm so với giá tiền
